days_ago,postdate,post_date,title,description,bloggername,link,query,source
0.0,20260112,2026-01-12,<b>요즘 핫한</b> 6구 큰 붕어빵 기계 붕어빵틀 만들기 미니붕어빵기계... ,"카페나 <b>디저트</b> 가게에서 판매하는 붕어빵과 같은 퀄리티를 집에서도 경험할 수 있습니다. 220V 전원을 사용하며, 안전 설계가 적용되어 안심하고 사용할 수 있습니다. 오늘 핫딜가 바로보기 가정용 업소용... ",aaykr 님의 블로그,https://aaykr.tistory.com/609,요즘 핫한 디저트,naver_blog
0.0,20260112,2026-01-12,더현대 서울 팝업 스토어 흑당고앰플 비클린 코스메쉐프... ,"향연, <b>음식</b>을 요리하는 것 처럼 화장품을 요리한다라는 슬로건으로 <b>요즘</b> 인스타에서 핫한 기초 라인... 에센스 그 밖에도 <b>요즘 유행</b>하는 방식의 거품이 나오는 에센스나, 패드, 비누, 클렌징, 팩 등 다양한... ",움직이는 레코드♪,https://blog.naver.com/0392oe/224143030463,요즘 유행 음식,naver_blog
0.0,20260112,2026-01-12,"[신상 털기] 2026년 1월 2주, 입맛 저격할 신상 먹거리 총정리... ","줄 <b>핫한</b> 신상들을 직접 먹어보고 솔직하게 리뷰해 드립니다. 공차의 쫀득한 펄부터 피자스쿨의 가성비 갑 피자, 그리고 스타벅스와 오예스의 새로운 시도까지! 지금 바로 만나보시죠! 공차 &amp; 오예스 <b>디저트</b> 타임... ",신통방통 정보통,https://blog.naver.com/0yangxe0/224143021683,요즘 핫한 디저트,naver_blog
0.0,20260112,2026-01-12,[부산 영도 가볼만한곳] 미피카페 자갈치 굿즈 미피스토어부터... ,<b>요즘 핫한</b> 피스타치오의 고소한 풍미가 부드럽게 입안을 감싸며 기분 좋은 달콤함을 선사합니다.... 특별한 <b>디저트</b>로 변신합니다. 소금 입자가 커피 향의 모카번과 입맛을 돋워줍니다. 겉은 바삭하고 속은... ,지요리는 행복할래,https://blog.naver.com/1amprincess/224140486476,요즘 핫한 디저트,naver_blog
0.0,20260112,2026-01-12,신선 육즙 야키토리 제대로인 왕십리 술집,"특히 <b>요즘 유행</b>하는 트렌디한 곳보다는 정갈하고 편안한 분위기가 끌렸던 날이었는데, 드디어 제가... 셰프님께서 귀한 시간 내어 찾아주신 손님들에게 최고의 요리를 대접하겠다는 마음이 <b>음식</b> 하나하나에... ",2845jj님의블로그,https://blog.naver.com/2845jj/224143227441,요즘 유행 음식,naver_blog
0.0,20260112,2026-01-12,2025 / 7월,한여름 2시간 웨이팅 성공적(?) 영종도 베토벤하우스 그 <b>핫한</b> 곳 와봤슴다 졸릴듯 말듯 하다가 음악 들으니 뮤지컬이 보고싶어졌어요. 나랑 뮤지컬 보러 갈 사람~ 카페 하루 3번 방문하기.. 시루앤케이크 <b>디저트</b>... ,나는 너의 단호박,https://blog.naver.com/5__0/224143278995,요즘 핫한 디저트,naver_blog
0.0,20260112,2026-01-12,프랑스루브르바게트 신세계 백화점 두바이쫀득쿠키 리뷰,#내돈내산 <b>요즘</b> SNS에서 핫한 두바이쫀득쿠키를 먹어봤어요! 인스타에 계속 떠서 궁금했는데... SNS에서 <b>유행</b>하는 <b>음식</b> 중에서도 맛있게 먹었고 동네에서도 한 번 더 구매해 보고 싶어요!! #프랑스루브르바게트... ,누안,https://blog.naver.com/929skdms/224143007029,요즘 유행 음식,naver_blog
0.0,20260112,2026-01-12,잠실 두쫀쿠 맛집 탐방: 두바이쫀득쿠키 팝업 소식!,"<b>요즘</b> 정말 <b>핫한 디저트</b>, 두바이쫀득쿠키! 일명 두쫀쿠인데요. 한 번 맛보면 잊을 수 없는 그 쫀득한 식감에 많은 분들이 잠실에서 이 맛있는 두쫀쿠를 어디서 만날 수 있을지 궁금해하세요. 오늘은 잠실에서... ",한끼버프키친,https://blog.naver.com/ajdzh2005/224143183723,요즘 핫한 디저트,naver_blog
0.0,20260112,2026-01-12,오사카 여행 패스 추천.. 우메다 난바 교통 관광지 동선 관리 팁,방문 전 번호표 시스템 및 휴무일 확인 전주 핫템 공략 <b>요즘</b> 전주에서 정말 <b>핫한 디저트</b>가 있다고 해서 찾아보신 적 있으신가요? 많은 분들이 찾아 헤매는 그 유명한 쫀득한 쿠키 말이에요. 저도 그 소문을... ,오늘의픽,https://blog.naver.com/akasf222/224143237119,요즘 핫한 디저트,naver_blog
0.0,20260112,2026-01-12,죽지말고 전화하세요 대신 해결해드립니다,제목은 모택 <b>요즘</b> 완전 빠졌음 첨엔 먼치킨 사이다물이었는데 이젠 그냥 이제훈의 똥꼬쇼 됨 너무웃김... 그리고 <b>유행</b>하는 마크 <b>음식</b> 사진 카페 가주고 빵 사주고 카메라 협찬 이원교 웡교가 사준 카메라로 모든... ,행복하진 못해도 그냥 살아봐야지,https://blog.naver.com/alwaysna0813/224143043400,요즘 유행 음식,naver_blog
0.0,20260112,2026-01-12,"영국 입국기(이스탄불 공항, tk1997)","낯선 <b>음식</b>이 좀 있어서 익숙한 것 위주로 담아왔다. 저 화이트 브레드라는 빵이 너무 부들부들해서... <b>요즘</b> 우리나라는 두쫀쿠 <b>유행</b>으로 피스타치오가 구하기 힘들다는데, 여기는 많이 있더라. 마트에서 버터랑... ",여유,https://blog.naver.com/angelajwblog/224143055491,요즘 유행 음식,naver_blog
0.0,20260112,2026-01-12,캐시워크 푸드루트 면역비타민C 캐시돈버는퀴즈정답1월12일,"그래도 처음이시라면 <b>음식</b>과 함께 먹는 게 좋아요. <b>요즘</b>엔 가격보다 ‘품질’이나 ‘제조 과정에 대한... 한동안 장 건강 제품이나 유산균이 <b>유행</b>하다가, <b>요즘</b>은 다시 ‘비타민C 리턴 시즌’이 온 듯해요. 특히... ",지금 이 순간,https://blog.naver.com/answernow_/224143206217,요즘 유행 음식,naver_blog
0.0,20260112,2026-01-12,5천원에 20알? 이순신광장 먹거리로 <b>핫한</b> 여수 호두과자 맛집,"있다면, <b>요즘</b> 가장 핫하게 떠오르는 곳이 바로 여수 호두과자 맛집 ‘여수로 온, 호두’입니다.... 가볍게 즐기기 좋은 이순신광장 <b>디저트</b> 맛집, 여수로 온 호두에서 든든하고 맛있는 간식 한 번 즐겨보세요.... ",다섯가족의 지나가는 시간,https://blog.naver.com/any_moment_/224143016043,요즘 핫한 디저트,naver_blog
0.0,20260112,2026-01-12,시키려다 두쫀쿠부터? <b>요즘</b> 배달 주문하다가 현타 오는 진짜 이유,순대국밥 #배달앱이슈 #조건부주문 #쿠키열풍 #국밥집디저트 #<b>요즘유행</b> #소비자반응 #자영업현실 #배달문화 #SNS<b>유행</b> #품절대란 #먹거리트렌드 #일상생각 #현타오는순간 #<b>요즘</b>배달 #디저트붐 #<b>음식</b>주문 #식문화변화,다나님의 블로그,https://blog.naver.com/aqaqaq222/224143130837,요즘 유행 음식,naver_blog
0.0,20260112,2026-01-12,명동역 맛집 곰탕 백옥 명동,따뜻한 <b>음식</b> 먹을 수 있다는 게 생각보다 큰 장점이더라고요. 부담 없이 들어와서 든든하게 한 끼 먹고 나가기 좋은 집이라는 느낌이 들었습니다. 명동 백옥은 화려하거나 <b>요즘 유행</b>하는 스타일의 맛집은... ,방구석 탐방가,https://blog.naver.com/armchair_traveler_v/224143272441,요즘 유행 음식,naver_blog
0.0,20260112,2026-01-12,친구랑 특별한 하루? 사진관에서 놀아보자!,"오늘은 <b>요즘 핫한</b> 액티비티 하나 소개해 줄게. 바로 사진 찍기!  <b>요즘</b>은 그냥 사진 찍는 게 아니라... 사진 보정 기다리면서 맛있는 <b>디저트</b>도 먹고, 친구랑 수다도 떨고, 그 자체가 또 하나의 추억이 될 거야.... ",계절 따라 페이지,https://blog.naver.com/aticonhni381/224143027426,요즘 핫한 디저트,naver_blog
0.0,20260112,2026-01-12,인천 계양 장원영 두쫀쿠로 유명한 팔레트디저트 5분 웨이팅... ,"<b>요즘</b> 두바이 쫀득 쿠키가 <b>유행</b>이죠? 인천 계양구에 제가 유명해지기 전부터 자주 다니던 곳인... <b>요즘</b> 두쫀쿠 막 7,000원씩 하던데 이정도면 가성비 이려나요..? 근처 계산동 최애 맛집 닥꼼에서 <b>음식</b> 기다리면서... ",해찌의 블로그ෆ,https://blog.naver.com/babc0987/224143083530,요즘 유행 음식,naver_blog
0.0,20260112,2026-01-12,[문래] 영등포 양평역 두바이쫀득쿠키 맛집 '카페비' 내돈내산... ,<b>요즘</b> 가장 <b>핫한</b> 인기 <b>디저트</b>라 다른 곳은 오후 늦게 가면 이미 품절인 경우도 많았는데 저녁시간에 방문해도 여유가 있더라구요 다만 워낙 인기가 많은 메뉴이다 보니 방문 전에 매장에 전화로 재고 확인하고... ,배츄의 하루(◕‿◕✿),https://blog.naver.com/bae_cchuu/224143200019,요즘 핫한 디저트,naver_blog
0.0,20260112,2026-01-12,욜로하다 골로 간다는 말이 현실로? 욜로족의 최후와 요노족... ,"날씨가 추워지니 몸도 움츠러들지만, <b>요즘</b> 뉴스나 경제 상황을 보면 마음까지 꽁꽁 얼어붙는 기분이 들... 이런 변화는 단순한 <b>유행</b>이 아니라 생존을 위한 몸부림에 가깝습니다. 편의점 도시락으로 점심을... ",최신 경제뉴스/빅테크. 분석,https://blog.naver.com/bigteck/224142814940,요즘 유행 음식,naver_blog
0.0,20260112,2026-01-12,고양시 지축 두쫀쿠 파는곳  | 노나먹당 두바이 쫀득 쿠키... ,음료랑 <b>디저트</b> 페어링 즐기는 분 ✔️ 선물용으로 “<b>요즘 핫한</b> 간식” 찾는 분(포장 깔끔) ✔️ 쫀득/꾸덕/고소한 식감 좋아하는 분 10. 한줄평 지축역 ‘노나먹당’ 두쫀쿠는 초코파우더 없이도 충분히... ,"오늘의 경험, 내일의 가치",https://blog.naver.com/bini_life_story/224143246691,요즘 핫한 디저트,naver_blog
0.0,20260112,2026-01-12,"<b>요즘 핫한</b> 두바이쫀득쿠키, 내돈내산 맛후기",#두쫀쿠 <b>요즘</b> 그렇게 핫하다는 두바이쫀득쿠키! 오픈런 아니면 못 산다길래 주말 아침에 오픈런까지... 제과점·<b>디저트</b> 가게 매출 증대…재료 수급난에 일부 가격 인상 #카다이프 #피스타치오 비쥬얼.... 그렇다면... ,느리지만 꾸준하게...,https://blog.naver.com/blablabla685/224143186899,요즘 핫한 디저트,naver_blog
0.0,20260112,2026-01-12,"미추홀구청 커피앤카롱 두바이쫀득쿠키 가격, 후기",안녕하세요 명블리입니다 오늘은 <b>요즘 핫한 디저트</b> ! 두바이쫀득쿠키 후기를 가지고 왔어요... 매력이에요 요즘 핫한 팔레트디저트 두쫀쿠 구하기 어렵잖아요.. 서로 다른 매력의 맛이라 착한 가격과 쉽게 구할... ,명페이지,https://blog.naver.com/bmj6253/224143009157,요즘 핫한 디저트,naver_blog
0.0,20260112,2026-01-12,강릉 길감자 솔직 후기｜중앙시장 웨이팅·소스·가격... ,"강릉 중앙시장에서 <b>요즘</b> 가장 <b>핫한</b> 먹거리를 꼽으라면 단연 ‘길감자’입니다. 바삭하면서도 쫀득한... 길거리 간식 느낌이지만, <b>디저트</b> 같은 구성으로 커플, 가족 단위 방문객들이 많습니다. 항목 정보 위치... ",똘똘이스머프의 세상밖으로,https://blog.naver.com/brainy_smurf/224143144757,요즘 핫한 디저트,naver_blog
0.0,20260112,2026-01-12,두바이쫀득이쿠키 샀어요,두 가게에서 구매했어요 처음 먹을 때는 별 관심 없었는데요 <b>요즘</b> 가장 <b>핫한 디저트</b> 라고 하니 맛있데요 저도 먹어 보았어요. 누구 말처럼 모래 씹는(?) 맛인데 왠지 묘한 매력이 있네요. 자꾸 손이 가긴 하네요.,소소한 행복,https://blog.naver.com/cdoomoo/224143184073,요즘 핫한 디저트,naver_blog
0.0,20260112,2026-01-12,수원역맛집 칼국수 만두 보쌈 쾌적한 곳,"특히 <b>요즘 유행</b>하는 맛집들을 찾아보다가, 수원역맛집으로 자주 언급되는 곳이 있더라고요. 복잡한... 단순히 한 그릇의 <b>음식</b>이 아니라, 그 안에 담긴 정성을 느끼고 싶다는 마음이 컸답니다. 과연 소문대로... ",champ720님의 블로그,https://blog.naver.com/champ720/224143288775,요즘 유행 음식,naver_blog
0.0,20260112,2026-01-12,그게 뭐라고 이렇게까지? 두바이 쫀득 쿠키 열풍의 민낯,"<b>요즘</b> SNS를 켜면 온통 ‘두바이 쫀득 쿠키(두쫀쿠)’ 이야기뿐입니다. 두쫀쿠를 사러 긴시간 기다린 경험... 심지어 <b>디저트</b>와 상관없는 초밥집이나 국밥집에서도 모객을 위해 이 쿠키를 구워 판다고 하니, 그... ",밥온랩,https://blog.naver.com/cherishui/224143320553,요즘 핫한 디저트,naver_blog
0.0,20260112,2026-01-12,두쫀쿠맵 지도ㅣ 실시간 재고확인 자주묻는 질문 ㅣ... ,"검색도가능해요 <b>요즘</b> SNS에서 <b>핫한 디저트</b> 중 하나가 바로 두바이 쫀득 쿠키인데요. 막상 먹어보려고 하면 어디서 파는지, 지금 재고가 있는지, 헛걸음하게 되는 경우도 많더라고요. 그래서 알게 된 게 바로... ","집사 3년차, 운동강사 10년차의 일상이야기",https://blog.naver.com/chlehddud89/224143303705,요즘 핫한 디저트,naver_blog
0.0,20260112,2026-01-12,화덕 베이글 곁들인 순수 과일 잠실 아사이볼,"건강한 <b>디저트</b>를 찾으시는 분들에게 딱 맞는 곳이 아닐까 싶어 기대가 컸어요. 친구랑 오랜만에 만나기로 해서 건강하고 맛있는 간식을 같이 먹으려고 고민하다가, 결국 SNS에서 <b>핫한</b> 잠실 아사이볼 맛집을... ",choi86-24님의 블로그,https://blog.naver.com/choi86-24/224143212814,요즘 핫한 디저트,naver_blog
0.0,20260112,2026-01-12,"유량동맛집, 어해랑왕코다리 천안유량점에서 만나는 프리미엄... ","오늘은 정말 <b>핫한</b> 맛집에 다녀왔어요. 바로 어해랑왕코다리 천안유량점인데요, 정말 이거 레전드... 수제 <b>디저트</b>까지 다양하게 준비되어 있어서 골라 먹는 재미가 쏠쏠했죠. 사실 <b>요즘</b> 제철 메뉴 찾기가 힘든데... ",슈가롱 맛집/ 여행 정보♡,https://blog.naver.com/choistan_ad/224143055994,요즘 핫한 디저트,naver_blog
0.0,20260112,2026-01-12,"[배달<b>음식</b>] 내돈내산 세번째 주문, 더 유명해졌으면 하는 '두찜... ",때처럼 <b>유행</b>했으면 하는 메뉴 (물론 그것도 겁나 맛있게 먹었지만.) 왜냐하면 모든 사람들이 맛보았으면 싶을 정도로 맛있그등요 ! #두찜 #두찜타코라구요 #타코라구요 #꾸덕한<b>음식</b> #배달<b>음식</b> #배달<b>음식</b>추천... ,yessomeday,https://blog.naver.com/cjy6361/224141048173,요즘 유행 음식,naver_blog
0.0,20260112,2026-01-12,[호평동 헬스장]아침 쉐이크 하나로 운동 효과 살리는 법... ,"그래서 <b>요즘</b> 많이 찾는 게 아침 대용 공복 단백질쉐이크. 근데 이거,  제대로 알면 개이득  모르고 마시면 그냥 <b>유행</b>템입니다. 1️⃣ 공복 단백질쉐이크의 장단점 ✔ 장점 아침에 위 부담 적음 밥, 빵 먹기 힘든... ",코엑스짐 호평점,https://blog.naver.com/coexgym3/224143160102,요즘 유행 음식,naver_blog
0.0,20260112,2026-01-12,일산 두쫀쿠 맛집 리니베이크 / 카페양심 밤리단길 두쫀쿠 비교,관련 <b>디저트</b>들을 판매하고 있는데 개인적으로 두쫀쿠 / 두바이 수건케이크 그리고 케이크가 맛있었던... 가격 <b>요즘</b> 정말 <b>핫한</b> 일산 두쫀쿠 맛집 중 밤리단길에 위치한 직접 방문한 총 3군데 중 리니베이크와... ,My favorite ❤️,https://blog.naver.com/cowqk1004/224142076800,요즘 핫한 디저트,naver_blog
0.0,20260112,2026-01-12,마이머랭 쫀득쿠키 오픈런 성공 꿀팁과 택배 주문 가이드,"<b>요즘</b> 가장 <b>핫한 디저트</b> 중 하나, 바로 마이머랭의 쫀득쿠키인 거 아시죠? 한 번 맛보면 헤어 나올 수 없는 마성의 매력 때문에 많은 분들이 오픈런과 치열한 '두켓팅'을 불사하고 있는데요. 과연 이 달콤한 유혹에... ",cozypics님의 블로그,https://blog.naver.com/cozypics/224143321587,요즘 핫한 디저트,naver_blog
0.0,20260112,2026-01-12,겨울 집밥 메뉴 : <b>요즘</b> 가장 자주 먹게 되는 겨울 <b>음식</b>,<b>요즘</b> 가장 자주 먹는 겨울 <b>음식</b>의 기준 <b>요즘</b> 자주 먹는 겨울 <b>음식</b>은 <b>유행</b>을 따라 고른 메뉴 보다는 추워진 날씨와 머무는 시간이 길어진 생활 패턴에 맞춰 자연스럽게 선택된 결과다. 어묵국과 만두국은 그... ,cts_79님의 블로그,https://blog.naver.com/cts_79/224140614909,요즘 유행 음식,naver_blog
0.0,20260112,2026-01-12,집에서 만드는 두바이쫀득쿠키(두쫀쿠) 레시피｜성형부터... ,<b>요즘</b> SNS에서 <b>핫한</b> 두바이쫀득쿠키 이른바 두쫀쿠! 몇 번 사먹다보니 어느 순간.. 점점 인기가 많아져서... 게 만족도가 훨씬 높았어요. 달달한 <b>디저트</b> 좋아하지만 너무 단 건 부담스러운 분께 강력 추천합니다.,채채자매와 나의 흔적,https://blog.naver.com/daisygirl55/224142933527,요즘 핫한 디저트,naver_blog
0.0,20260112,2026-01-12,카브루 말차하이볼 편의점 신상하이볼 리뷰,"안녕하세요~ 위섹시입니다~ <b>요즘</b> 말차가 아주 <b>유행</b>인 거 다들 아시죠?! 음료는 물론 각종 과자, 디저트를... 어울리는 <b>음식</b> ◈ 핑거푸드, 치킨, 튀김류, 전 다음은 스트로베리 말차 하이볼인데요~ 벌써부터... ",내맘대로 위당탕탕,https://blog.naver.com/daraparkk/224142893782,요즘 유행 음식,naver_blog
0.0,20260112,2026-01-12,1인석 2인석 팀룸 다양한 먹거리 최고사양 상남동 피시방 토브PC,상남피시방입니다 <b>요즘</b> 아이온2가 <b>유행</b>인 만큼 사양이 정말 중요한데 다들 랙 없이 아이온2 빡겜중... 맛있는 <b>음식</b>들이 있는 피시토랑 그 자체~ 창원 상남동 새로운 핫플레이스 !! #토브피시방 방문... ,뽕맛로그,https://blog.naver.com/dbsqhfka8/224143096979,요즘 유행 음식,naver_blog
0.0,20260112,2026-01-12,대전 닭갈비 맛집 5.5닭갈비 본점｜대전 닭갈비 생각날 때 결국... ,닭갈비는 아무 때나 먹는 <b>음식</b>은 아니다. 냄새가 꽤 오래 남아서 마음먹고 먹어야 한다. 그래서 세탁할... 총평 5.5닭갈비 본점은 <b>요즘 유행</b>하는 스타일의 집은 아니다. 하지만 그게 오히려 장점이다. 대전 닭갈비... ,대충먹자,https://blog.naver.com/dceat/224143015084,요즘 유행 음식,naver_blog
0.0,20260112,2026-01-12,"대전 중앙동 빵집 성심당 케익부띠끄, 딸기설기 2026년 연초... ","<b>디저트</b> 맛집, 케이크 구매 목적의 새벽 여정! 케익부띠끄 현장 스케치! 안녕하세요. 블로거... 집 모양 메종 케익도 있고 <b>요즘</b> 인기가 <b>핫한</b> 딸기시루, 말차시루, 딸기설기 등이 영롱한 비주얼을 뽐내고 있어요.... ",인생은 즐겁고 행복하게 By 탐화향수,https://blog.naver.com/ddbye/224142532342,요즘 핫한 디저트,naver_blog
0.0,20260112,2026-01-12,"윤아, 진짜 '폭군의 셰프'였네 직접 만든 '두쫀쿠' 자랑 남다른... ",만든 디저트를 공개하며 남다른 손재주를 뽐냈다. SNS로 전한 홈베이킹 근황 사진 출처 - 윤아 인스타... <b>요즘 핫한 디저트</b> ‘두쫀쿠’ 완성 사진 출처 - 윤아 인스타 공개된 사진에는 윤아가 직접 만든... ,ddongddong111님의 블로그,https://blog.naver.com/ddongddong111/224142707880,요즘 핫한 디저트,naver_blog
0.0,20260112,2026-01-12,"쌍문동 30년 노포, 바다장어구이 맛집ㅣ현대아파트 상가... ","인테리어도, <b>유행</b>을 좇은 메뉴 구성도 아니다. 오직 장어, 숯불, 손님. 이 세 가지에만 집중해온 시간이 그대로 녹아 있는 공간이다. 바다장어구이 ㅡ 왜 몸에 좋다고 할까? 장어 하면 흔히 “기력 회복 <b>음식</b>”... ",영끌인생연구소｜영끌교육센터,https://blog.naver.com/dhw123/224142622116,요즘 유행 음식,naver_blog
0.0,20260112,2026-01-12,"31] <b>유행</b>을 안 타는 게 아니라, '클래식'을 지키는 겁니다.... ","<b>요즘</b> 그거 없어서 못 판대.' 제가 자존심이 있지, 커피 전문점에서 <b>유행</b> 따라 급조한 디저트를 팔고... 주변에서 쿠키를 사 온 손님에게 &quot;외부 <b>음식</b> 반입 금지&quot;라고 하지 말고, &quot;그거랑 제일 잘 어울리는 커피를... ",신드롬 소믈리에,https://blog.naver.com/diein12/224143272965,요즘 유행 음식,naver_blog
0.0,20260112,2026-01-12,집밥이 최고 인건 어느 나라나 똑같은 불변의 법칙,소위 말하는 고급 요리가 <b>유행</b>하는 <b>요즘</b>임에도 나는 여전히 세상에 맛있는 <b>음식</b>의 수는 세상의 어머니의 수와 같다는 말을 좋아한다. 맛있는 <b>음식</b>의 최고는 결국 집밥이다. 이건 어느 나라도 상관없는 어느... ,내일 쓰는 어제의 하루,https://blog.naver.com/different-name/224143041438,요즘 유행 음식,naver_blog
0.0,20260112,2026-01-12,"한국인의 쫀득 DNA, 두바이 쫀득 쿠키가 터진 이유",동아시아는 원래 '씹는 감각'을 먼저 본다 서구권 <b>음식</b> 문화를 떠올려보면 평가 기준은 비교적... #두바이쫀득쿠키 #두쫀쿠 #쫀득쿠키 #디저트추천 #<b>요즘유행</b> #한국인취향 #식감 #ASMR푸드 #단면샷 #푸드트렌드... ,디그딥 DigDeep,https://blog.naver.com/digdeep_jh/224143260456,요즘 유행 음식,naver_blog
0.0,20260112,2026-01-12,<b>요즘 핫한</b> 두쫀쿠! 동탄 두바이쫀득쿠기 맛집 페이버랏,<b>요즘</b> 가장 <b>핫한 디저트</b> 두바이 쫀득 쿠키 두쫀쿠예요. 그중에서도 페이버랏은 동탄 두쫀쿠 맛집으로 소문이 자자한 곳이에요. 원래는 커피 마시러 종종 가던 카페였는데 언제부턴가 동탄 두바이 쫀득쿠키... ,여행 가이드집 ◡̈,https://blog.naver.com/dkfmak34/224142820698,요즘 핫한 디저트,naver_blog
0.0,20260112,2026-01-12,두바이 쫀득 쿠키 인기 비결.. 분당 정자동 아이들 대기 소동과... ,<b>핫한 디저트</b> 이야기 <b>요즘</b> SNS나 주변에서 '두바이 쫀득 쿠키' 얘기 정말 많이 들리시죠? 단순한 간식 하나가 어떻게 이렇게 큰 화제가 되고 사회적인 이야기까지 만들어내는지 궁금하셨을 거예요. 이 글에서는... ,타아툰,https://blog.naver.com/dksvkfdk11/224143152662,요즘 핫한 디저트,naver_blog
0.0,20260112,2026-01-12,서수원맛집 와룡각 방문기 삼선짱뽕·삼선간짜장·군만두까지... ,전체적으로 느낀 와룡각 후기 ✔️ <b>음식</b> 나오는 속도 빠른 편 ✔️ 양 넉넉해서 가성비 좋음 ✔️ 불맛 살아 있는 정통 중국집 스타일 ✔️ 부담 없이 자주 올 수 있는 동네숨은맛집 <b>요즘 유행</b>하는 화려한... ,일상의 생각여행,https://blog.naver.com/dlstjsltnsw/224143255750,요즘 유행 음식,naver_blog
0.0,20260112,2026-01-12,서울/상암 _ <b>요즘 핫한</b> ✨두쫀쿠✨를 판매하는 카페 &lt;필아웃&gt;,［오늘의 포스팅］ <b>요즘 핫한</b> 두쫀쿠를 판매하는 카페 &lt;필아웃&gt;  ⏰ 08:00 - 18:00 (매주 토요일 정기휴무)... 끝 #상암카페 #상암베이커리 #상암<b>디저트</b> #상암두쫀쿠 #필아웃상암점 #상암필아웃 #필아웃... ,⠀⠀,https://blog.naver.com/dlwlswn1122/224143304908,요즘 핫한 디저트,naver_blog
0.0,20260112,2026-01-12,"광주 첨단 두쫀쿠 맛집 보자기커피, 비아동 보자기커피",<b>요즘</b> sns에서 핫하다는 두쫀쿠 드셔보셨나요? 저도 드디어 그 유명한 두바이 쫀득 쿠키를 먹어봤는데요... 편승한 <b>음식</b> 아닐까 싶었거든요. 근데 직접 먹어보니까 완전히 생각이 바뀌었어요. 이건 <b>유행</b>이 아니라... ,woong’s blog,https://blog.naver.com/dmsql7100_/224142763797,요즘 유행 음식,naver_blog
0.0,20260112,2026-01-12,율량동 빵집ㅣ쌀로당ㅣ노밀가루 에그타르트 두바이 <b>디저트</b>,빵집이에요 <b>요즘 핫한</b> 두바이 <b>디저트</b>도 종류별로 있더라구요 주말 1시쯤 방문했습니다 100% 국산 우리쌀을 이용하고 밀가루를 전혀 사용하지 않은 빵이 있어요 당일반죽 / 당일판매라 신선한 빵으로 먹을 수... ,나의 기록지 ᰔ,https://blog.naver.com/dmsql8424/224143230429,요즘 핫한 디저트,naver_blog
0.0,20260112,2026-01-12,두바이 쫀득쿠키 두쫀쿠 팝업 후기_내돈내산,림림이에요:) <b>요즘</b> 하도 두쫀쿠두쫀쿠...해서 그냥 넘어갈 수가 없었습니다 ㅋㅋ 보통 오픈런해서... 보이시나유 1인 2개로 구매수량을 제한해두었어요 다른데에서도 두쫀쿠는 워낙 <b>핫한 디저트</b>라 구매수량... ,동가네 림림로그,https://blog.naver.com/donge_g0/224143194476,요즘 핫한 디저트,naver_blog
