days_ago,postdate,post_date,title,description,bloggername,link,query,source
0.0,20260112,2026-01-12,망원역/마포구청역 '도래노트' 망원동카페,<b>요즘 핫한</b> 거 다 쓰고 있네요.. 그라인더 탐나... 메인 에스프레소 머신은 마밤(MAVAM). 처음 보는... 그래서 사장님께 추천해 주실만한 <b>디저트</b>가 뭐가 있냐 했을 때 카다멈번을 추천해 주셨어요. 그래서 그거... ,쪼소소로그,https://blog.naver.com/jjoso-/224142797480,요즘 핫한 디저트,naver_blog
0.0,20260112,2026-01-12,'두쫀쿠 챌린지' 두바이 쫀득 쿠키 열풍에 피스타치오 가격까지... ,<b>요즘</b> 디저트 좋아하시는 분들이라면 한 번쯤 들어보셨을 이름이 있습니다. 바로 두바이 쫀득 쿠키.줄여서 두쫀쿠입니다. SNS에서 시작된 <b>유행</b>이 어느새 동네 카페와 제과점의 진열대를 바꿔놓았고.급기야... ,스페셜타임스,https://blog.naver.com/jjubika1/224143228614,요즘 유행 음식,naver_blog
0.0,20260112,2026-01-12,흑백요리사 송훈셰프의 송훈파크 제주도 식당 인테리어업체,<b>요즘 핫한</b> 프로그램인 흑백요리사 보셨나요? 흑백요리사 백수저로 출현한 송훈셰프의 제주도 식당과... 커피와 <b>디저트</b>를 즐길 수 있는 환경을 조성했습니다. 구축 건물 전체를 외관부터 내관까지 전체... ,제이케이컴퍼니 블로그,https://blog.naver.com/jkcompany_tv/224143298096,요즘 핫한 디저트,naver_blog
0.0,20260112,2026-01-12,인천 두산 위브 더 센트럴 송림동 놀이매트 층간소음 완화 효과... ,매운 <b>음식</b>이 같이 <b>유행</b>하기도 하였습니다.또 물을 직접 끓여서 마시는 집이라면 곡류를 넣어서... <b>요즘</b>같은 날에는 날씨가 이랬다가 저랬다가 변덕이 심해서 어디에 해서 그런지 어느 장단에 맞춰야 할지 알수가... ,우주매트의 조용한 하루,https://blog.naver.com/jmyjtfarjc/224097257175,요즘 유행 음식,naver_blog
0.0,20260112,2026-01-12,대전 궁동 달콤한행복 두바이쿠키 명란소금빵.. 웨이팅 오픈런... ,달콤한 행복 혹시 <b>요즘</b> 유행하는 특별한 간식을 찾아서 길을 나선 적 있으신가요? 평소에 빵이나 과자를 좋아하시는 분들이라면 한 번쯤 들어보셨을 법한 아주 <b>핫한</b> 장소가 있어서 소개해 드리려고 해요. 대전... ,jnkcfx2136님의 블로그,https://blog.naver.com/jnkcfx2136/224143119165,요즘 핫한 디저트,naver_blog
0.0,20260112,2026-01-12,장유 두바이쫀득쿠키 비교 후기 (페리도트 vs 김덕규베이커리),<b>요즘 핫한 디저트</b> 중 하나가 바로 “두쫀쿠”! 이름부터 너무 귀엽고ㅋㅋㅋㅋ 먹어보면 진짜 쫀득+고소+달달 그 자체라서 디저트 좋아하면 꼭 먹어봐야 해요. 근데 장유에는 두쫀쿠를 파는 곳이 페리도트... ,오용이네가족이야기:),https://blog.naver.com/joraeyoung7/224143016989,요즘 핫한 디저트,naver_blog
0.0,20260112,2026-01-12,[부산 기장] 한정식 찾는다면 토암 위치·가격·구성부터... ,<b>음식</b> 하나하나 정성 한가득ㅎㅎ) 이 말 저만 웃긴가요 ㅋㅋㅋㅋㅋㅋ 1인 다섯 그릇까지 공짜라고 합니다... <b>요즘 유행</b>하는 화려한 플레이팅이나 SNS 용 맛집 느낌보다는 꾸준히 선택받는 이유가 있는... ,주땡이의 후기보따리 여행/맛집/추천,https://blog.naver.com/juhea3072/224142893834,요즘 유행 음식,naver_blog
0.0,20260112,2026-01-12,"최연소 제과명장의 손길, 수신당 '두바이 쫀득 쿠키' 솔직 후기",<b>요즘</b> 가장 <b>핫한 디저트</b>라면 단연 '두바이 초콜릿' 스타일이죠! 수신당의 최연소 제과명장이 직접 만들었다고 해서 더 기대가 컸던 두바이 쫀득 쿠키를 가져왔습니다. 귀여운 패키지에 담긴 이 작은 쿠키... ,밥심은 국력의 맛있는 이야기,https://blog.naver.com/jylhee0704/224142565344,요즘 핫한 디저트,naver_blog
0.0,20260112,2026-01-12,제주도 소금빵 맛집 아라파파 소금빵 6종 포장해서 먹어본... ,제주도 여행 중에 절대 빼놓을 수 없는 즐거움이 바로 빵지순례잖아요 그중에서도 <b>요즘</b> 가장 <b>핫한</b>... 고급스러운 <b>디저트</b>를 먹는 느낌이라 좋았어요 한 끼 식사로도 손색없을 만큼 든든했던 에그마요 소금빵은... ,쿠지 보고서,https://blog.naver.com/kangjung_/224143269584,요즘 핫한 디저트,naver_blog
0.0,20260112,2026-01-12,방어동 <b>디저트</b>카페  *카페 루앤비*,<b>요즘</b> 울산에서 <b>핫한</b> 메뉴중 하나죠? 라면땅!!!!! 전국에서 줄선다는 모아라면땅 때문에 덩달아 잘팔릴... 이상 방어동 <b>디저트</b> 카페 카페루앤비 포스팅이였습니다. #울산동구<b>디저트</b> #울산방어동카페... ,내 인생은 지금부터...,https://blog.naver.com/kjlove3871/224143298680,요즘 핫한 디저트,naver_blog
0.0,20260112,2026-01-12,"단양 구경시장 맛집들 공영주차장, 모노레일",단.양.구.경.시.장 단양 여행전 여행 유튜버 채널이랑 <b>먹방</b> 유튜버 채널 돌려보면 찾아 본 맛집을 갈... <b>편의점</b>에 평양냉면 육수가 테이크아웃 음료 처럼 있더라고요. 나쁘지 않은 발상 같습니다 ㅎㅎ 아들이... ,♬♬엄마는 즐거운탐구생활 중♬♬ 하쿠나마타타,https://blog.naver.com/klnu-ing/224142995488,편의점 신상 먹방,naver_blog
0.0,20260112,2026-01-12,“진짜 셰프였네” 소녀시대 윤아 품절 대란 ‘두쫀쿠’ 독학... ,소녀시대 멤버이자 배우로 활약 중인 윤아가 최근 <b>디저트</b> 업계에서 가장 <b>핫한</b> 아이템인 '두쫀쿠'를 직접... 사진 속에는 <b>요즘</b> 연일 품절 대란을 일으키며 구하기조차 힘들다는 두바이 쫀득 쿠키가 먹음직스럽게... ,겟 필드,https://blog.naver.com/knowledgestore/224142936693,요즘 핫한 디저트,naver_blog
0.0,20260112,2026-01-12,[경주 혼자 여행/2박 3일] 야무지게 말아주는 뚜벅이 경주 여행,"행복한 이야기 끝나니깐 보고싶지 않더라구,, 야무지게 황리단길에서 <b>요즘 핫한</b> 쫀득이도 먹어줬음!... 배불러서 <b>디저트</b>는 패스하고, 미젤라떼를 시켰는데, 쌀젤라또가 신기하니 맛있었음! 쌀알이 냠냠 씹히고... ",소소한 공대생의 일상,https://blog.naver.com/kny1071/224143064221,요즘 핫한 디저트,naver_blog
0.0,20260112,2026-01-12,나고야 가족 여행 숙소 : 넓은 객실 니코 스타일 호텔 추천,"<b>신상</b> 호텔 특유의 깔끔함과 감성까지 챙긴 이곳, 과연 소문만큼 괜찮았을까요? 결론부터 말씀드리면... 창가 쪽에는 소파와 테이블이 있어서 <b>편의점</b> 간식 사와서 먹기 딱 좋았어요. TV 위치도 침대에서 누워서... ",KOJA_HOTEL,https://blog.naver.com/koja_hotel/224141981869,편의점 신상 먹방,naver_blog
0.0,20260112,2026-01-12,[코스트코 쇼핑] 이건 꼭 사야 해! 내돈내산 꿀템 리스트 BEST 9,나가사키 카스테라 (신상!) <b>요즘</b> 코스트코에서 가장 <b>핫한 디저트</b>빵입니다. • 바닥면에 '자라메 설탕(굵은 설탕 결정)'이 박혀 있는 게 신의 한 수예요. • 씹을 때마다 설탕이 오독오독 씹히면서 달콤함이 확... ,MoMo,https://blog.naver.com/ksyoon95/224143137899,요즘 핫한 디저트,naver_blog
0.0,20260112,2026-01-12,"SNS가 만든 <b>디저트</b> 광풍, 오픈런까지 등장한 이유",<b>요즘</b> 카페나 <b>디저트</b> 매장에 가면 꼭 듣게 되는 단어가 있어요. 바로 '두쫀쿠’예요. 두바이 쫀득 쿠키의... 하지만 지금 이 순간만큼은 확실히 <b>핫한</b> 아이템이에요.  자영업자들의 새로운 기회 두쫀쿠 열풍은... ,훈바오 월드,https://blog.naver.com/kth4828/224143112453,요즘 핫한 디저트,naver_blog
0.0,20260112,2026-01-12,윤아 두쫀쿠 만들기 실화? ‘폭군의 셰프’ 소환된 이유,"윤아 sns <b>요즘</b> 가장 <b>핫한 디저트</b>, 두바이 쫀득 쿠키(두쫀쿠)를 처음부터 끝까지 진짜로 만들어 반응이 뜨겁습니다. 출처: 윤아 인그타그램 버터에 볶은 카다이프, 고 소한 피스타치오 크림, 쫀득함의 핵심... ",세상에서 가장 영화로운 수업,https://blog.naver.com/kwaang2/224143000707,요즘 핫한 디저트,naver_blog
0.0,20260112,2026-01-12,역시 대령숙수 출신? 윤아가 만든 ‘두쫀쿠’ 클래스가 달랐다,한복 입고 차분하게 <b>음식</b> 만들던 모습이랑 이번 두쫀쿠 만드는 사진이 이상하게 겹쳐 보임  그래서... 셀럽근황 #<b>요즘유행</b> #힐링콘텐츠 #일상공유 #윤아사랑 #소시영원히 #연예인요리레시피 #쿠킹로그 #집콕취미... ,부자의 그릇,https://blog.naver.com/kwf38/224143176331,요즘 유행 음식,naver_blog
0.0,20260112,2026-01-12,<b>요즘 핫한</b> 전통 <b>디저트</b> / 연리희재 개성주악,&lt;사진출처: 컬리&gt; 안녕하세요 꼼지락꼼지락입니다 오늘은 MZ세대의 입맛을 사로잡은 <b>요즘 핫한</b> 전통 <b>디저트</b>인 연리희재 개성주악에 대해 포스팅해 볼게요 연리희재는 ‘인연이 만나면 기쁨이 된다’는 뜻을... ,꼼지락꼼지락,https://blog.naver.com/kyy7725/224143064538,요즘 핫한 디저트,naver_blog
0.0,20260112,2026-01-12,CU 신상 <b>디저트</b> 스샤스 요거트샌드 솔직 후기 ㅣ 기대이상 맛도리,ㅠㅠ 그중에서도 <b>요즘</b> CU에서 <b>핫한</b> 후르츠 샌드를 보긴했었는데! 사실 요거트 크림 + 샌드 조합은 맛없없 이자나요 상큼한 <b>디저트</b> 좋아하는 사람이라면 그냥 지나칠 수 없는 조합이라.. 바로 먹어봤숩니다 사실... ,쮸's 일상로그♥,https://blog.naver.com/larlarl3/224143026270,요즘 핫한 디저트,naver_blog
0.0,20260112,2026-01-12,"군산두쫀쿠 두쫀볼 , 이번에 흑쫀볼이다.군산도로시아두쫀쿠","군산 두쫀쿠 이번엔 흑쫀볼 후기｜조촌동 도로시아 줄 서서 사 먹은 솔직 후기 <b>요즘</b> 군산에서 가장 <b>핫한 디저트</b>, 아니 대한민국에서 가장 <b>핫한</b> 두쫀쿠 줄 서서 사 먹는다는 두쫀쿠 대열에 저도 결국... ",밝음맘의 맛있는일상,https://blog.naver.com/leejh7243/224143191313,요즘 핫한 디저트,naver_blog
0.0,20260112,2026-01-12,청주 내수 카페 에피 외곽 대형카페 크림라떼 <b>디저트</b> 맛집,<b>요즘</b> 내수에 <b>핫한</b> 신상카페가 많이 생기고 있는 듯. 최근 캘리포니아 카페로 핫해진 내수인데 거기에 버금가는 <b>디저트</b> 맛집 카페 에피   위치  충북 청주시 청원구 내수읍 도원세교로 350 1층 EPPY ⏰ 영업시간... ,이루현,https://blog.naver.com/leeruhyun_/224143230824,요즘 핫한 디저트,naver_blog
0.0,20260112,2026-01-12,"대학로 속 무채색 감성, 에이라운드(A'ROUND) | 밤 티라미수와... ","감각적인 인테리어는 물론, <b>요즘 핫한 디저트</b>인 밤 티라미수까지 완벽하게 즐기고 온 후기를... 밤 티라미수 (강력 추천!) 8,500원 요즘 밤을 활용한 디저트가 대세잖아요? 이곳의 밤 티라미수는 혀가 아릴... ",흠냥의 모든리뷰ㅇO,https://blog.naver.com/lemon_tre-e/224142898580,요즘 핫한 디저트,naver_blog
0.0,20260112,2026-01-12,서울 두바이쫀득쿠키 맛집 카페 포모 강남 두쫀쿠 포장 웨이팅... ,한 번 먹고나니 중독성이 강해서 또 먹고싶어지는 <b>디저트</b> 두바이쫀득쿠키! 서울 두쫀쿠 맛집으로 유명한 강남 카페 포모에 다녀왔어요 카페 포모는 <b>요즘 핫한</b> 강남 두바이쫀득쿠키 맛집으로 유명한 곳인데요... ,"맛집, 여행, 육아 정보 나누는 푸드 인플루언서",https://blog.naver.com/lemonic119/224143288864,요즘 핫한 디저트,naver_blog
0.0,20260112,2026-01-12,서울 두바이 쫀득쿠키 카페 추천!  데이라이트 서울 두바이... ,"마침 오픈 시간 즈음과 맞아 <b>요즘 핫한</b> 두쫀쿠를 먹어보러 갔어요. 12:30 오픈, 도착 시간 12:45 이미 줄을 쫙 서 있더군요. 매장 안은 협소해서 5팀 정도 들어… KW:<b>디저트</b>가 맛있어요,특별한 메뉴가 있어요... ",전국 핫플레이스,https://blog.naver.com/lettuce0904/224143025981,요즘 핫한 디저트,naver_blog
0.0,20260112,2026-01-12,서울 상견례 후기 - 동화고옥 서울역점,같다 <b>요즘</b>은 애교예단이라 해서 상견례자리때 작은 선물도 준비하나 본데 우리는 아무 것도 준비하지 않았다 프레젠테이션 하는것도 <b>유행</b>인듯 해서 할까 하다가 이미 다 아시는 얘기 또 해서 뭐하나 싶어... ,연자의 삶,https://blog.naver.com/lifeofyeonja/224143214629,요즘 유행 음식,naver_blog
0.0,20260112,2026-01-12,매운맛 솔직 후기｜생각보다 매워? <b>편의점 신상</b> 컵라면 리뷰,환영합니다  #gs25 #GS25<b>신상</b> #<b>편의점</b>라면 #감자면매운맛 #감자면후기 #컵라면추천 #오늘의점메추 #<b>편의점신상</b> #매운라면 #<b>편의점</b><b>먹방</b> #라면리뷰 #GS25추천 #점심메뉴추천 #<b>편의점</b>간식 #라면덕후 #매운컵라면... ,라이프트렌더 트렌드 플레이스,https://blog.naver.com/lifetrend_lab/224143109329,편의점 신상 먹방,naver_blog
0.0,20260112,2026-01-12,1월 일상 1 :: 오랜만이에요.,무늬는 다르지만~~ 새해 첫 <b>음식</b>은 근본있게 떡국이어야만 하잖아. 엄마가 당면 아깝다고 엄청... 밥먹고 카페에 가서 사온 두쫀쿠 <b>요즘</b> 나랑 쌍디는 두쫀쿠에 미쳐있다. 우리가 이렇게나 디저트에 미쳤던 적이... ,Et Memórĭa,https://blog.naver.com/lko_zl/224143040570,요즘 유행 음식,naver_blog
0.0,20260112,2026-01-12,완전 좋았던 용인 양지 맛집 외할머니집 추천 후기,최신 <b>유행</b> 스타일이라기보다는 전통의 맛을 잘 살린 집이라 더욱 기억에 남을 것 같습니다. 가족이나... <b>요즘</b> 같은 추운 날씨에 뜨끈한 밥 한 그릇을 앞에 두고 <b>음식</b>을 나누는 시간을 갖는 것이 얼마나 소중한지... ,반짝반짝 현이네 일상,https://blog.naver.com/llpniw907/224143322162,요즘 유행 음식,naver_blog
0.0,20260112,2026-01-12,편의점두쫀쿠/세븐일레븐 픽업 추천템 두쫀쿠 꾸덕바삭... ,말럽이입니다:-) <b>요즘</b> 두바이 초콜렛 스타일 <b>디저트</b>가 핫하죠?ㅋㅋ 편의점 마다 비슷한 신상들이... 세븐 일레븐 앱 편의점 픽업 방법 <b>요즘 핫한</b> 편의점 신상은 재고 찾기가 하늘의 별따기 인데 저처럼 세븐... ,말럽이네 놀이터,https://blog.naver.com/lovejamong2/224143172714,요즘 핫한 디저트,naver_blog
0.0,20260112,2026-01-12,불닭보다7배 매운 GS 용사라면 솔직 후기,<b>요즘 유행</b>하는 <b>음식</b>들이 참 많은데 두쫀쿠만큼 유명한 용사라면을 구해봤어요 gs25에서 1800원주고 구매했어요 메이플콜라보같은데 이벤트는 딱히없는것같아요 매운걸로 엄청 유명하대요 스코필지수가 불닭의... ,"햇블리의 맛집, 여행",https://blog.naver.com/lovelove071/224143015112,요즘 유행 음식,naver_blog
0.0,20260112,2026-01-12,"<b>요즘 핫한</b> '두바이 쫀득 쿠키(두쫀쿠)' 창업, 진짜 돈이 될까?... ",<b>요즘</b> <b>디저트</b> 카페 업계에서 가장 뜨거운 키워드는 단연 두쫀쿠죠. SNS를 장악한 비주얼과 특유의 바삭한 식감 덕분에 창업 아이템으로 고려하시는 분들이 정말 많습니다. 하지만 &quot;재료비가 비싸다던데... ,시나브로의 일기,https://blog.naver.com/lucy0965/224143324640,요즘 핫한 디저트,naver_blog
0.0,20260112,2026-01-12,김포아트빌리지 후 건강한 샐러드바 있는 담백한 한정식,"함께 간 일행 모두 자극적이지 않으면서도 정갈한 <b>음식</b>을 선호해서, 건강한 느낌의 식당을 찾게... 특히 인테리어가 너무 예뻤는데, 딱딱한 한정식집 느낌이 아니라 <b>요즘 유행</b>하는 카페 같은 감성적인 분위기라... ",구름이 씩씩하게 살아가기,https://blog.naver.com/mina4856/224143268664,요즘 유행 음식,naver_blog
0.0,20260112,2026-01-12,광주 양림동양식 요작 스테이크 코스요리 내돈내산 기념일 데이트,"가능 <b>요즘</b> 광주 데이트 코스 중에서 <b>핫한</b> 곳으로 소문난 양림동양식 요작 , 저도 기념일 맞아서 특별한... 요작의 대표 메뉴는 브레드부터 스프, 샐러드, 파스타, 볶음밥, 스테이크 , <b>디저트</b>까지 이어지는... ",유심히 mindfully,https://blog.naver.com/mindfully7/224142031991,요즘 핫한 디저트,naver_blog
0.0,20260112,2026-01-12,[전주 객리단길] LP 감성에 취하고 위스키에 반하는 공간... ,✨ 두바이쫀득김밥 <b>요즘</b> 가장 <b>핫한</b> 두바이 초콜릿 스타일을 재해석한 메뉴예요! 쫀득한 식감과... 시그니처 <b>디저트</b>예요. 한 입 베어 물면 풍부한 식감과 맛의 밸런스에 감탄하게 된답니다.  Banana Pudding... ,맛집 찾으러 떠나는 여행 ~,https://blog.naver.com/mindo_754/224143321323,요즘 핫한 디저트,naver_blog
0.0,20260112,2026-01-12,"아이디어스에서 저렴한 두쫀쿠 맛집 - 쿠키도레 / 1,000원 쿠폰... ",(100% 내돈내산) <b>요즘</b> 두바이쫀득쿠키가 아주 유행이잖아요? 처음에는 유행이겠거니… 했는데... 유행하는<b>디저트</b> #<b>핫한디저트</b> #검색폭발 #실시간인기 #두바이초콜릿만들기 #카다이프파는곳 #쫀득함의끝판왕... ,맛집 찾아 뽈뽈,https://blog.naver.com/mine_y_ours/224143203070,요즘 핫한 디저트,naver_blog
0.0,20260112,2026-01-12,"댓거리PT, 효과 좋을까?",특히 <b>요즘 유행</b>하는 고기집들이 눈에 띄게 많았답니다. 고기 맛집 리스트 제가 눈여겨본 곳 중에는 숙성... 다양한 <b>음식</b>을 조금씩 맛보는 재미가 쏠쏠해요. 힐링 타임 카페 운동이 끝나면 시원한 커피 한 잔은... ,minimal7858님의 블로그,https://blog.naver.com/minimal7858/224143240762,요즘 유행 음식,naver_blog
0.0,20260112,2026-01-12,"장원영이 올린 그 쿠키, <b>요즘</b> 가장 <b>핫한 디저트</b> 두쫀쿠... ","<b>요즘</b> 제과점 앞 풍경, 이거 <b>디저트</b> 사러 온 건지 콘서트 티켓 예매 줄인지 헷갈릴 정도입니다. 문 열리기 전부터 줄 서 있고, 문 열리자마자 “오늘 끝났어요” 소리 들리면 허탈함이 밀려오죠. 그 모든 혼란의... ",글을 써본다,https://blog.naver.com/mk9764/224143294702,요즘 핫한 디저트,naver_blog
0.0,20260112,2026-01-12,부산소금빵맛집 명지빵집 꿈꾸는요리사,"다녀왔어요 :) <b>요즘</b> #부산소금빵맛집 떠오르는 곳들 중에서 <b>핫한</b> 곳! 다양한 빵 종류부터 <b>디저트</b>, 심지어 케이크까지 맛있다고 소문난 #명지빵집 가게에 들어선 순간부터 빵 굽는 냄새가... 다양한 빵이 정말... ",감자의 일상.,https://blog.naver.com/mmmmm_s0710/224143272672,요즘 핫한 디저트,naver_blog
0.0,20260112,2026-01-12,GS25 두쫀쿠 후기 _ <b>요즘</b> 제일 <b>핫한</b> 편의점 <b>디저트</b>,"<b>요즘</b> 편의점 <b>디저트</b> 치고는 살짝 높은 편이지만, 워낙 화제인 상품이라 안 살 수가 없었어요 :) 패키지와 보관 방법 패키지는 박스 형태가 아니라 비닐 포장을 종이 슬리브로 감싼 구조였어요. 옆으로 스윽 빼면... ",몽동그리네 우당탕탕 일상,https://blog.naver.com/mongdong0214/224142466024,요즘 핫한 디저트,naver_blog
0.0,20260112,2026-01-12,"홍대입구역 춘장포차, 적은 인원으로도 다양한 중국요리를 맛볼... ",<b>요즘</b> 인기를 얻고 있는 대만요리 계열인 매운 바지락볶음을 터치했어요 가격대를 보면 <b>음식</b> 양이 적을... 최신<b>유행</b>이나 맛있는 식당 찾아다니는 사람들은 다른 사람들도 다 그런 줄 알고 있는 경향이 강합니다.... ,돈내고사먹읍시다,https://blog.naver.com/mudoidoi/224141277061,요즘 유행 음식,naver_blog
0.0,20260112,2026-01-12,"<b>요즘 핫한</b> 두바이 쫀득 쿠키, 웨이팅 대신 집에서 만드는... ","<b>요즘</b> SNS만 켜면 계속 보이는 두바이 쫀득 쿠키. 겉은 바삭한데 손은 쫀득, 거기에 피스타치오의... 쿠키 반죽 외에도 다른 빵이나 와플 위에 발라, 집에 있는 재료들을 토핑해서 먹어도 카페 <b>디저트</b> 느낌이 날것... ",my_dear1315,https://blog.naver.com/my_dear1315/224142992589,요즘 핫한 디저트,naver_blog
0.0,20260112,2026-01-12,[일상]<b>요즘 핫한 디저트</b> 털기! 두쫀쿠 vs 무인양품신상... ,"<b>요즘 핫한 디저트</b> 털기! 두쫀쿠 vs 무인양품신상 스페큘라스 솔직후기 요즘 SNS만 켜면 보이고, 디저트 좀... 궁금했음 '-' 디저트 처돌이인 내가 이런 핫한 유행을 그냥 지나칠 순 없잖아? 근데 문제는 가격임;ㅁ;... ",어느 청춘의 소소한 기록:),https://blog.naver.com/myself_91/224141724930,요즘 핫한 디저트,naver_blog
0.0,20260112,2026-01-12,식사동 두쫀쿠 딸기케이크 맛집 일산 빵집 토모루 베이커리,"있고 <b>디저트</b>류도 있고 소금 빵이나 쿠키도 있었음 아, 계산하며 들어보니 여기 두쫀쿠도 판매하나... 다양하고 <b>요즘 핫한</b> 두쫀쿠도 판매하고 있으니 일산 빵순이라면 한번 gogo~! 그럼 오늘은 여기까지쓰고 다음... ",나라의 트래블로그,https://blog.naver.com/naralatte/224142984792,요즘 핫한 디저트,naver_blog
0.0,20260112,2026-01-12,"용인 쿠쥬라이크 두바이 쫀득 쿠키, 구매 개수 제한과 솔직한... ",오늘은 <b>요즘</b> 가장 <b>핫한 디저트</b>죠? SNS를 뜨겁게 달구고 있는 '두바이 초콜릿'의 쿠키 버전인 두바이 쫀득 쿠키(두쫀쿠)를 찾아 다녀온 솔직한 기록을 남겨보려고 해요. 쿠쥬라이크 두바이쫀득쿠키(두쫀볼) 솔직... ,끄적이는 기록장,https://blog.naver.com/nayajiyee/224142842582,요즘 핫한 디저트,naver_blog
0.0,20260112,2026-01-12,"2026년 외식 환경 변화, 현장에서 다시 세운 생존 전략","저 역시 <b>요즘</b> 가장 많이 하는 고민은 이것입니다. “우리 가게는, 이 환경에서 정말 살아남을 수... “<b>유행</b> 타는 메뉴가 아니라, 100년 가는 ‘생활 메뉴(피자)’에 지역색을 입힌 것은 탁월한 선택이다.” 이... ",외식업 경영 스토리,https://blog.naver.com/neckbone0e/224143105677,요즘 유행 음식,naver_blog
0.0,20260112,2026-01-12,✨ 두바이 <b>디저트</b> 4종원가·판매가·판매처·프로모션·집에서... ,프리미엄디저트 #디저트유행 #<b>요즘핫한디저트</b> #카페사장님필독 #디저트장사 #디저트레시피 #집에서만들기 #홈베이킹 #홈디저트 #두바이쿠키 #두바이감성 #사치디저트 #고당도디저트 #꾸덕디저트... ,ll감각적인 요언니ll,https://blog.naver.com/new_angle/224143112013,요즘 핫한 디저트,naver_blog
0.0,20260112,2026-01-12,&lt;&lt; 두바이 쫀득 <b>디저트</b> 4종미슐랭급 레시피 · 공정 · 시간... ,향 &gt;&gt;&gt;&gt;&gt; 요즘 디저트 시장에서 중요한 건 “새로운 맛”이 아니라 “설명 가능한 맛” 입니다.... 디저트마진 #디저트창업 #소자본창업 #부업아이템 #카페사장님 #디저트트렌드 #<b>요즘핫한디저트</b>... ,ll감각적인 요언니ll,https://blog.naver.com/new_angle/224143115836,요즘 핫한 디저트,naver_blog
0.0,20260112,2026-01-12,주목할만한 울산 언양불고기 맛집 작괘천불고기 기대 이상임!,"아이들이 좋아하는 음식과 함께 맛있는 <b>디저트</b>까지 즐길 수 있어 더욱 만족스러웠습니다. 다시 꼭... <b>요즘 핫한</b> 감성 식당인 만큼 분위기도 너무 좋고, 친구들과 함께하면 더욱 즐겁답니다!고기 질이 정말... ",맛강이의 맛집일기,https://blog.naver.com/nhpxq387/224143262782,요즘 핫한 디저트,naver_blog
0.0,20260112,2026-01-12,광명역 일직동 카페 찬란 두쫀쿠 오픈런 에그타르트 JMT,동네분들이 소소하게 조용히 맛있는 <b>디저트</b>와 가볍게 티타임하기 좋은 곳인데 <b>요즘</b>은 두쫀쿠 오픈런 때문에 핫하디 <b>핫한</b> 곳입니다. 참고로 광명 카페 카페 찬란은 두쫀쿠 이전에 에그타르트와 에그 스콘... ,세쌍둥이 육아 / 일상 / Etc..,https://blog.naver.com/nilriri83/224143199475,요즘 핫한 디저트,naver_blog
0.0,20260112,2026-01-12,<b>요즘 핫한</b> 두바이 초코케이크 파는 곳 청주 율량동 &quot;좋은아침... ,베이커리에서 <b>디저트</b> 사고서 매장에 테이블에 앉아서 먹고 갔어요~ (집에 포장하고 가기 긔찮아서 ㅋㅋ)... 그리고 <b>요즘</b> 신메뉴로  두바이 초코케이크도 판매 중이더라구요! <b>요즘</b> 제가 두쫀쿠(?)에 꽂혀 있어서... ,예비신부 아오배고팡,https://blog.naver.com/nm2536/224143005823,요즘 핫한 디저트,naver_blog
