days_ago,postdate,post_date,title,description,bloggername,link,query,source
0.0,20260112,2026-01-12,"몸과 마음이 따뜻해지는 힐링 플레이스, 여기 정말 괜찮은... ",그리고 <b>요즘</b> 세상에 꼭 필요한 무선 인터넷도 빵빵하게 터졌어요. 맛있는 <b>음식</b>을 사진 찍어 친구들에게... 이곳의 <b>음식</b>들은 화려한 기교보다는 재료 본연의 맛을 극대화하려는 장인 정신이 느껴졌어요. <b>유행</b>을... ,천천히 살아가기,https://blog.naver.com/sus241ubt1i2t/224143055380,요즘 유행 음식,naver_blog
0.0,20260112,2026-01-12,강남 카페 그릭베리 역삼 아사이볼 맛집 두바이 초코... ,"안녕하세요 수zip입니다 강남 역삼에서 건강한 <b>디저트</b> + 맛까지 포기 못하는 분들, 운동 후나 출근 전... 두바이 초코 칩스 요거트 아이스크림 12,600원 / 강남 두쫀쿠보다 맛있음 <b>요즘</b> 핫하디 <b>핫한</b> 바로... ",연 이을 공간,https://blog.naver.com/suyeonnii_j/224142998611,요즘 핫한 디저트,naver_blog
0.0,20260112,2026-01-12,일산/밤리단길 쌍수 붓기도 이겨낸 맛! 두바이 쫀득볼 맛집... ,"오늘은 두쫀쿠로만 담아았네요~~ 밤리단길에서 정말 맛있는 <b>디저트</b>, 특히 <b>요즘 핫한</b> 두바이 스타일을 제대로 느끼고 싶다면 밤리샌드 꼭 한번 들러보세요!  밤리샌드 위치 및 정보 #두바이쫀득볼... ",sylove2008님의 블로그,https://blog.naver.com/sylove2008/224143028367,요즘 핫한 디저트,naver_blog
0.0,20260112,2026-01-12,주말에 줄 서서 먹은 영통 하울즈 두바이쫀득쿠키 솔직 후기,"<b>요즘</b> 계속 <b>핫한</b> 두바이쫀득쿠키 때문에 일부러 시간 맞춰 방문했어요. 주소 경기도 수원시 영통구... 특징 • <b>디저트</b> &amp; 커피 전문 감성 카페 • 두바이 쫀득쿠키, 휘낭시에, 등이 인기 메뉴 • 실내 분위기... ",태겨미의 빵빵한 일상,https://blog.naver.com/taegumi_09/224143238245,요즘 핫한 디저트,naver_blog
0.0,20260112,2026-01-12,안성 아양지구 보리밥 정식 맛집 푸짐하던 봄이보리밥,맛집이 많기로 <b>핫한</b> 아양지구에 다녀왔습니다 지난번에 왔다가 또 들른 안성 보리밥 정식집으로... 다채롭게 나오고 입이 심심하지 않던 조합들 <b>디저트</b>도 잘 되어 있어서 가심비도 느껴지던 안성 보리밥 정식집,설연의 맛있는 일상,https://blog.naver.com/taengbong89/224143280118,요즘 핫한 디저트,naver_blog
0.0,20260112,2026-01-12,연남동 주차카페 넓고 쾌적한 커피 빵 맛집,<b>요즘</b> 날씨가 너무 좋아서 친구와 함께 연남동 나들이를 계획했어요. 워낙 <b>핫한</b> 동네라 주말에는 사람이... 신선하고 맛있는 베이커리 덕분에 <b>디저트</b> 타임까지 완벽하게 마무리할 수 있었답니다. 연남동에서 찾기... ,일상 공유한다 뚜딱,https://blog.naver.com/tautau00/224143267805,요즘 핫한 디저트,naver_blog
0.0,20260112,2026-01-12,체코 전통 <b>디저트</b>를 집에서 스마트스토어 굴뚝빵 맛집 몽브... ,"최근 SNS에서 <b>핫한 디저트</b> 중 하나인 굴뚝빵, 여러분은 드셔보셨나요? 저는 이번에 몽브 베이커리의... <b>요즘</b> 건강한 먹거리에 관심이 많아서 첨가물이 들어가지 않은 제품을 찾고 있었거든요. 주문하면 그때그때... ",이상향(理想鄕),https://blog.naver.com/three_letter/224142998774,요즘 핫한 디저트,naver_blog
0.0,20260112,2026-01-12,안산 고잔동 온호프베이크샵 두쫀쿠 솔직 후기 8살 딸 취저,"완전 핫한 할무니잖아 빵순이 딸과 손녀를 위해 비 오는 날 줄서사 사다 주신 메뉴는?! 딸기랑 초코... ㅎㅎ <b>요즘 핫한 디저트</b> 맛집다운 묵직한 가격.. ..이라고 생각했는데, 휘낭시에 가격은 괜찮은데 두쫀쿠가... ",일단 혼자키웁니다만,https://blog.naver.com/tink1022/224142984989,요즘 핫한 디저트,naver_blog
0.0,20260112,2026-01-12,육아일기 D+416~422 | 13개월아기 일상 2025년 마무리 2026년... ,아무래도 감기가 심상치않아 연말인데 이게 뭐람 ㅠㅠㅠㅠ 그래도 <b>음식</b>은 맛있어서 잘들어간다 입맛은... - 2차 메뉴는 <b>요즘 유행</b>하는 피자스쿨 피자 + 불닭 입맛은 안떨어지네? 야무지게 또 먹기 1.4 일요일... ,코코찬하루,https://blog.naver.com/tktmzp1010/224143028533,요즘 유행 음식,naver_blog
0.0,20260112,2026-01-12,을지로 정통 숯불 꼬치와 시원한 하이볼 맛집,"특히 <b>요즘 유행</b>하는 하이볼 한 잔 딱 곁들이면 더할 나위 없겠다 싶었는데, 마침 정통 숯불 꼬치... 간단히 서서 먹는 분위기 덕분인지, 부담 없이 맛있는 <b>음식</b>을 마음껏 즐길 수 있었답니다. 가볍게 한잔하기 좋은... ",핫플레이스 찾기,https://blog.naver.com/tngml180527/224143272168,요즘 유행 음식,naver_blog
0.0,20260112,2026-01-12,"줄 서서 사는 두쫀쿠, 천안 신불당 3.14파이에선 아직까지 바로... ","3.14pie 구움과자•디저트 화-토 10:00 - 19:00 정기휴무 매주 일,월 충남 천안시 서북구 불당동 1838 요즘... 14파이 #신불당카페 #천안맛집 #줄안서도사는두쫀쿠 #<b>요즘핫한디저트</b> #신불당핫플 #디저트후기... ",정며든 하루,https://blog.naver.com/todi_/224143074976,요즘 핫한 디저트,naver_blog
0.0,20260112,2026-01-12,두바이 <b>디저트</b> 시리즈 #1 - 핫이슈 CU 카다이프 초코 브라우니... ,오늘은 <b>요즘</b> 핫하디 <b>핫한</b> CU 두바이 <b>디저트</b>인 카다이프 초코 브라우니와 카다이프 쫀득 마카롱 포스팅하려고 합니다! <b>요즘 핫한</b> 카다이프초코 쫀득 찹쌀떡을 찾으러 CU에 들어갔는데 보이지 않아 꿩대신... ,스타대디와 스타의 반짝반짝 빛나는 일상,https://blog.naver.com/tofollowmymind/224143154133,요즘 핫한 디저트,naver_blog
0.0,20260112,2026-01-12,"중곡동헬스장, 토니바디W우먼에서 알려드리는 <b>요즘 핫한</b>... ","회원님들, <b>요즘</b> SNS를 뜨겁게 달구고 있는 <b>디저트</b>, 혹시 드셔보셨나요? 바로 두바이 초콜릿의 유행을 이어받은 '두바이 쫀득 쿠키', 줄여서 '두쫀쿠'인데요! 바삭한 카다이프 면과 고소한 피스타치오 스프레드... ",토니바디W 여성전용 헬스장,https://blog.naver.com/tonybodyw/224143025963,요즘 핫한 디저트,naver_blog
0.0,20260112,2026-01-12,동성로 밀리스 유럽 분위기 속 특별한 연말모임,"오랜만에 만나는 소중한 사람들과 특별한 시간을 보내고 싶어서, <b>요즘 핫한</b> 연말모임 장소를 물색하던... 후 <b>디저트</b> 타임까지 완벽하게 즐길 수 있겠더라고요. 풍미가 폭발하는 특별한 파스타 경험 먼저 맛본... ",좋은 정보 나누면서 소통해요♡,https://blog.naver.com/twinmom0613/224143208405,요즘 핫한 디저트,naver_blog
0.0,20260112,2026-01-12,"행궁동 일식 톤톤톤, 아는 사람만 아는 소울푸드 맛집 탐방기요!",시원함이 입안 가득 퍼지면서 매콤하거나 기름진 <b>음식</b>을 깔끔하게 정리해주는 느낌이랄까요 게다가 <b>요즘 유행</b>하는 하이볼 메뉴 중 연태하이볼을 시켰는데 은은한 과일 향과 함께 기분 좋은 취기가 올라왔어요.... ,행복한 기억이 모여있는 곳,https://blog.naver.com/txicb85076/224143002495,요즘 유행 음식,naver_blog
0.0,20260112,2026-01-12,익산 소고기 황금식당 급랭삼겹살 신선함 사이드 맛집,"<b>요즘</b> 들어 부쩍 날씨가 쌀쌀해지면서 따뜻하고 든든한 <b>음식</b>이 생각나더라고요. 특히 스트레스 받을 때... 친구와 저는 <b>요즘 유행</b>하는 '냉삼'이 땡겨서 폭풍 검색을 했는데요, 그중에서도 특히 후기가 좋은... ",오늘하루도 힘차게,https://blog.naver.com/txttx/224143227803,요즘 유행 음식,naver_blog
0.0,20260112,2026-01-12,용인 맛집 김량장동 참숯구이 쾌적한 모임 장소,"오랜만에 만나는 친구들이라 북적이지 않으면서도 맛있는 <b>음식</b>을 즐길 수 있는 곳을 찾았는데, 제가... <b>요즘 유행</b>하는 맛집들도 좋지만, 이렇게 기본에 충실하면서도 맛있는 고기를 합리적인 가격에 즐길 수... ",um_09님의 블로그,https://blog.naver.com/um_09/224143244703,요즘 유행 음식,naver_blog
0.0,20260112,2026-01-12,[별가람역헬스장/운동가짐] “두바이 쫀득 쿠키 열풍”... ,특히 스트레스가 많거나 다이어트 중인 상태라면 몸은 자연스럽게 고당·고지방 <b>음식</b>을 더 원하게 됩니다. 그래서 <b>요즘</b>처럼 피로와 스트레스가 많은 시기에 두바이 쫀득 쿠키가 더 <b>유행</b>하는 거죠.... ,운동가짐 별내점,https://blog.naver.com/undong8634/224143241654,요즘 유행 음식,naver_blog
0.0,20260112,2026-01-12,김천 마루베이커리 <b>요즘 핫한</b> 두바이쫀득쿠키 처음 먹어본... ,<b>요즘</b> sns는 물론 맘 카페까지 들썩이게 만든 두바이쫀득쿠키! 며칠 전 동생이 김천에서 꽤 소문난... 김천에서 <b>디저트</b>를 좋아하시는 분들 사이에서는 이미 잘 알려진 곳입니다. 김천 율곡 식자재마트 앞 파란색... ,로니이야기:여행과발견,https://blog.naver.com/userra/224143330858,요즘 핫한 디저트,naver_blog
0.0,20260112,2026-01-12,(아이와 카페) [원주] 깊은숲속 아늑한 아지트 '림카페',"신상카페를 포함해서, <b>요즘 핫한</b> 두쫀쿠 파는 카페나 아님 오래되었지만 내가 모르던 카페 등등. 그리고... 그 외 케이크와 베이글칩도 팔고 있어서 <b>디저트</b>도 즐길수 있다. (오늘은 가서 바스크 치즈케이크랑 더블... ",행복한 커피,https://blog.naver.com/warmbros/224143046411,요즘 핫한 디저트,naver_blog
0.0,20260112,2026-01-12,"행궁동 라멘 맛집 톤톤톤, 이곳이 <b>요즘</b> '힙'한 이유 궁금하지... ",날씨가 쌀쌀해지니까 괜히 마음이 따뜻해지는 <b>음식</b>이 당기잖아요 제 입맛을 제대로 사로잡은 곳이... 특히 <b>요즘 유행</b>하는 하이볼 메뉴 라인업이 눈에 띄더라고요. 상큼한 연태하이볼도 좋았고 깔끔한... ,즐거운 일상 풍요로움,https://blog.naver.com/we7r8779f4q/224143015789,요즘 유행 음식,naver_blog
0.0,20260112,2026-01-12,웨이팅하다 동상 걸릴 뻔? 집에서 즐기는 두쫀쿠 택배 BEST 4... ,제가 대신 싹 다 찾아봤습니다.&quot; <b>요즘</b> SNS 켜면 온통 초록빛 피스타치오 물결이죠? 저도 집에서 한번... 그래서 저 같은 '집순이 미식가'들을 위해 방구석 1열에서 받을 수 있는 고퀄리티 두바이 <b>디저트</b> 정보를... ,"세상의 모든 리뷰, 최지피티",https://blog.naver.com/whddns27/224143175015,요즘 핫한 디저트,naver_blog
0.0,20260112,2026-01-12,"바다 보며 힐링하기 좋은 영종도 카페, 바다앞농장 다녀왔어요",<b>요즘</b> SNS에서 <b>핫한</b> 영종도 카페들이 많지만 바다앞농장은 정말 특별한 매력이 있더라고요. 바다 보며... <b>디저트</b> 메뉴 <b>디저트</b>로는 딸기 요거트 케이크를 주문했는데 상큼한 딸기와 부드러운 요거트 크림이... ,"타인의 시선이 아닌, 나의 시선 속에 살기",https://blog.naver.com/white9520/224142465996,요즘 핫한 디저트,naver_blog
0.0,20260112,2026-01-12,서울 명동 놀거리 <b>요즘</b> 뜨는 롯데백화점 <b>디저트</b> 팝업... ,"제이제이 <b>디저트</b>, 아벡쉐리, 샘케이크 4. 가야하는 이유 5. 방문 후기 <b>요즘</b> SNS에서 <b>핫한</b> 간식들을 즐길 수 있는 서울 명동 놀거리들이 한자리에 다 있다는 거 아실까요?  빵순이로서 참새가 방앗간 못... ",모리송,https://blog.naver.com/who_u_who/224143239422,요즘 핫한 디저트,naver_blog
0.0,20260112,2026-01-12,압구정역. 앤헤이븐. 현대백화점 본점. 피자 맛집 식당. 팝업... ,"<b>요즘</b> 서울 물가나 백화점 입점 식당인 걸 감안하면 터무니없는 가격은 아니다. 특히 와인 콜키지가... 만석닭강정 같은 단골손님도 있지만, 성수동 등 전국 <b>핫한 디저트</b>들이 매주 바뀐다. 최근의 픽은... ","윈나인. 맛집, 여행, 독서",https://blog.naver.com/win-nine/224134933394,요즘 핫한 디저트,naver_blog
0.0,20260112,2026-01-12,영국 빵빵러닝(1)_런던 베이커리 맛집 러닝하면서 뿌시기,"오자마자 먹은 첫 <b>음식</b>은 당연 선데이 로스트(Sunday roast)다. 선데이로스트랑 할루미치즈 튀김... <b>요즘</b> 런던도 일본풍, 한국풍 카페가 <b>유행</b>인가 보다. 칼리코커피(Calico Coffee) 라고 되게 의자도... ",생각연습,https://blog.naver.com/wjddbswl95/224143128316,요즘 유행 음식,naver_blog
0.0,20260112,2026-01-12,잠실놀거리 송리단길데이트 더스피어 게티이미지,"석촌호수의 잔잔한 물결, 송리단길의 아기자기한 카페들, 그리고 <b>요즘 핫한</b> 미디어아트 전시까지 한... 도보 10분 남짓한 거리에는 예쁜 <b>디저트</b> 카페와 개성 넘치는 브런치 가게가 즐비합니다. 미디어아트의... ",#희릿블로그,https://blog.naver.com/wlgml3237/224143269935,요즘 핫한 디저트,naver_blog
0.0,20260112,2026-01-12,베이징 여행 싼리툰 카페 추천| 헤이티 블랙 프리미엄... ,아시아 전문 트래블가이드 여행 인플루언서 희수입니다:) <b>요즘</b> 베이징에서 제일 <b>핫한</b> 동네인 싼리툰! 싼리툰에서 돌아다니면서 쇼핑하다가 당떨어질 때 달달한 <b>디저트</b>랑 카페인 충전 타임 필요하잖아요.... ,희수의 아시아 트래블가이드,https://blog.naver.com/wltjq717/224141031576,요즘 핫한 디저트,naver_blog
0.0,20260112,2026-01-12,두쫀쿠 대란! SNS 때문에 난리 난 <b>디저트</b>의 정체,"<b>요즘</b> <b>디저트</b> 유행은 정말 무섭다 싶어요. 이런 이야기가 나오니, 대체 이 '두쫀쿠'가 뭔지, 왜 이렇게... 이렇게 <b>핫한</b> '두쫀쿠', 나도 한번 맛보고 싶다 하시는 분들을 위해 제가 몇 가지 꿀팁을 알려드릴게요!... ",세상에 WoW,https://blog.naver.com/wow_365/224143204086,요즘 핫한 디저트,naver_blog
0.0,20260112,2026-01-12,천호 두쫀쿠 비교 길동 강동 두바이쫀득쿠키 블랑제리11-17... ,천호동과 길동 사이 빵지순례 필수 코스로 꼽히는 블랑제리11-17에 다녀왔습니다 <b>요즘 핫한</b> 두바이 쫀득... 다양한 <b>디저트</b>와 빵을 구경하는 재미도 있고 실패 없는 빵 맛집인 건 확실합니다 다만 천호 두쫀쿠... ,제법이네,https://blog.naver.com/wpqjq_/224143023876,요즘 핫한 디저트,naver_blog
0.0,20260112,2026-01-12,대구 동성로 술집 아침까지 하는 핫한 신상 헌팅술집 수풀림... ,말차가 들어간 <b>요즘 유행</b>하는 <b>음식</b>들도 여러개 있다고 해서 갔는데 제 최애가 되어버렸답니다~! 1. 수풀림 동성로점 주소 : 대구 중구 동성로5길 84 1층 번호 : 0507-1418-3220 영업시간 : 매일 17:00 - 07:00 대표메뉴... ,T없이 맑은 I,https://blog.naver.com/wwfic6if24/224143315175,요즘 유행 음식,naver_blog
0.0,20260112,2026-01-12,순수 과일 아사이볼 베이글 든든 잠실 카페,"맛있는 <b>디저트</b>를 먹고 싶어서 발걸음을 옮겼답니다. 친구와 함께 가볍게 산책하고 나서 시원한 무언가를 마시며 이야기를 나누고 싶었는데, 마침 SNS에서 <b>핫한</b> 잠실 카페가 있다는 소식을 듣고 찾아가 보게 된... ",재성이네,https://blog.naver.com/xjjsx1/224143255521,요즘 핫한 디저트,naver_blog
0.0,20260112,2026-01-12,서현순대는 오래 남는 가게가 되고 싶습니다.,"<b>요즘 유행</b>하는 화려한 인테리어나 자극적인 메뉴도 없습니다. 대신 매일 같은 자리에, 같은 방식으로... 저는 순대국이 “와!” 하고 놀라는 <b>음식</b>이라고 생각하지 않습니다. 오히려 “그래, 이 맛이지” 하고... ",나가주(나는 가게 주인이다),https://blog.naver.com/xsx528/224143242046,요즘 유행 음식,naver_blog
0.0,20260112,2026-01-12,"부천카페 인더시즌, 송내역카페 <b>디저트</b>도 브런치도 모두 만족!","건 <b>디저트</b> 종류가 정말 많다는 점이었어요. 단순히 몇 가지만 있는 게 아니라, 쇼케이스 안이 꽉 차 있어서 고르는 데 시간이 꽤 걸리더라고요. <b>요즘 핫한</b> 두바이쫀득쿠키도 있었는데, 계속 나가는 인기... ",맛집 탐방 일기,https://blog.naver.com/yeeeonb/224143198648,요즘 핫한 디저트,naver_blog
0.0,20260112,2026-01-12,"울산 두바이쫀득쿠키, 까드망 웨이팅, 플루토 비교, 내돈내산","<b>요즘</b> 핫해도 너무 <b>핫한 디저트</b>죠 두쫀쿠 울산 &quot;두바이쫀득쿠키&quot; 두곳 내돈내산 리뷰입니다 몬드제과는 웨이팅 심하다해서 엄두도 못냈구요 까드망 ✔️영업시간 10:00-20:30 (토요일 정기휴무) 두쫀쿠, <b>디저트</b>... ",찌니로그,https://blog.naver.com/yejin0325/224143291289,요즘 핫한 디저트,naver_blog
0.0,20260112,2026-01-12,기버터뜻 일반 버터와 어떻게 다를까요?,"<b>요즘</b> 사람들이 기버터를 찾는 이유 기버터가 다시 주목받는 이유는 <b>유행</b> 때문만은 아닙니다. ✔️ 집에서 요리하는 사람이 늘었고, ✔️ 불 조절이 어려운 환경에서도 안정적인 기름이 필요하고, ✔️ <b>음식</b> 향을... ",예조의 건강과 숨표,https://blog.naver.com/yejohealth/224143208209,요즘 유행 음식,naver_blog
0.0,20260112,2026-01-12,두쫀쿠 칼로리 피스타치오 스프레드 카다이프 다이어트에... ,"<b>요즘</b> 가장 <b>핫한</b> 것 중 하나, 바로 두쫀쿠입니다. 피스타치오 스프레드와 카다이프 조합으로 식감과... 피스타치오 스프레드 카다이프(얇은 면 형태의 반죽) 초콜릿 또는 코팅 베이스 겉보기에는 고급 <b>디저트</b>... ",튼튼한 김봄동,https://blog.naver.com/yj30770/224143077751,요즘 핫한 디저트,naver_blog
0.0,20260112,2026-01-12,세븐일레븐 직원이 낋여주는 편의점 4사 두쫀쿠 비교!! 과연... ,"(편순이 아님ㅜㅜ다들 처음엔 오해하심,,,영업관리직이에영) <b>요즘</b> 두쫀쿠가 이리 <b>핫한</b>데! 점포에서... CU SNS<b>핫한</b> 아이템이나 <b>디저트</b>를 정말 빠르게 잘 출시하는 브랜드죠! 아마 처음 출시도 CU였던걸로... ",美好一天！,https://blog.naver.com/yj5229948/224143169621,요즘 핫한 디저트,naver_blog
0.0,20260112,2026-01-12,두바이쫀득쿠키(두쫀쿠) 재고 확인법! 두쫀쿠 맵 활용 구매 성공... ,"<b>요즘</b> <b>디저트</b> 덕후들 사이에서 가장 <b>핫한</b> 키워드가 뭔지 아시나요? 맞아요, 바로 두바이쫀득쿠키입니다! 줄여서 '두쫀쿠'라고도 부르죠. 저도 유행에 뒤처지기 싫어서 동네 편의점이랑 카페를 싹 돌았는데... ","읽고 쓰고 공부하는 투니허니 교육,정보,상식 이야기",https://blog.naver.com/yongsoks/224143309367,요즘 핫한 디저트,naver_blog
0.0,20260112,2026-01-12,또 한 해를 보내며,꼬질꼬질한데 <b>요즘</b> 귀여워 죽겠어 정말 연말기념 아현이 만나기 예약하고 간 <b>음식</b>점에 이런 귀여운... 대신 집에서 만들어도 양이 1인분은 아니었다는 후문 <b>요즘 유행</b>이라는 마라샹궈+계란초밥 조합으로... ,happiness in everyday,https://blog.naver.com/yoon_wave/224143049932,요즘 유행 음식,naver_blog
0.0,20260112,2026-01-12,커피다루다/경주카페/감포카페,인원이 총6명이라서 여기는 잠시 포토존으로 즐기다 왔어요 중간중간에 꾸며놓은 곳들 <b>요즘 핫한</b> 두바이초코 카다이프 풀빌라 가기전 카페다루다에서 아이들이랑 <b>디저트</b> 같이 먹으면서 잠시 머무르기 좋아요,유별,https://blog.naver.com/you_star_/224143042578,요즘 핫한 디저트,naver_blog
0.0,20260112,2026-01-12,묵호야 무코야 머하니,"느껴졌어요 <b>음식</b>, 분위기, 소품 등등 •• 그리구 릴스에 가장 많이 뜨는 카페로 이동 -- 그동안 사람이... 완저니 <b>요즘</b> 갬성  카페 앞에 무료 주차장이 크게 있어서 너무 좋았어요! 소품샵도 다 인근이라 카페... ",귿 라잎,https://blog.naver.com/youngwestt/224143066727,요즘 유행 음식,naver_blog
0.0,20260112,2026-01-12,[충무로맛집] <b>핫한</b> 두쫀쿠... 약과한국이 원조인 K<b>디저트</b>,"<b>요즘</b> 최신 유행 두쫀쿠!! 한국이 원조인거 아시나요? 두둥~~ 두바이초콜릿 속재료인 피스타치오... 말차유즈에이드,호지참외라떼,로우앤스윗 -<b>디저트</b> : 두바이쫀득쿠키 약과, 덴마크빵, 무화과페어... ",YOURTONE_나의 일상,https://blog.naver.com/your_tone/224142942664,요즘 핫한 디저트,naver_blog
0.0,20260112,2026-01-12,[서울특별시 용산구] 릴리앤바인,외관 <b>요즘 핫한</b> 에그앤플라워 앞에 위치 ㅋㅋ 릴리앤바인 내부 처음엔 손님이 많이 없었는데... 만들어주었닷 <b>디저트</b> 서비스로 주셨는데 줄리아 차일드의 레시피로 만든 초콜릿 무스 오렌지 리큐어를... ,서초구불주먹의 맛따라 멋따라,https://blog.naver.com/zooriya/224143193036,요즘 핫한 디저트,naver_blog
0.0,20260112,2026-01-12,숙성회 고기 기본찬 맛집에서 즐기는 완벽 잠실회식,"<b>요즘</b> 부쩍 <b>핫한</b> 방이동 먹자골목 근처라 접근성도 좋았고, 특히 '맛'에 대한 평이 워낙 좋아서 기대감이... 다음번에는 부모님을 모시고 와서 푸짐한 백숙이나 담백한 인절미 <b>디저트</b>를 함께 맛보고 싶어요.... ",zzang104_,https://blog.naver.com/zzang104_/224143301355,요즘 핫한 디저트,naver_blog
1.0,20260111,2026-01-11,[수원/행궁동] 키프카페(KIFF) 두바이 쫀득 쿠키 맛집 웨이팅... ,갱스터민입니다 <b>요즘</b> <b>디저트</b>계의 고트 두쫀쿠(두바이쫀득쿠키)가 난리죠? 인스타에서 매일... 팔레트<b>디저트</b> 두바이쫀득쿠키 1. 팔레트 <b>디저트</b> 두쫀쿠 top집 중 한 곳이죠 럭키비키님이 샤라웃한 곳 <b>핫한</b>... ,카페 좋아하는 사람,https://blog.naver.com/2_kyeongmin/224142938670,요즘 핫한 디저트,naver_blog
1.0,20260111,2026-01-11,신라면 골드 직접 끓여본 솔직 후기,"ヾ(*´∇`)ﾉ 요즘 <b>편의점</b>이랑 마트에서 자주 보이던 신라면 골드, 이름부터 뭔가 고급져 보여서... 신라면후기 #라면리뷰 #라면추천 #봉지라면 #집밥 #야식추천 #라면덕후 #농심 #<b>신상</b>라면 #라면끓이기 #<b>먹방</b>",에이미 하우스,https://blog.naver.com/aaa-mmm-yyy/224142438531,편의점 신상 먹방,naver_blog
1.0,20260111,2026-01-11,[청주 일상] 가을부터 밀린 겨울 끝자락까지 청주에서 보내는... ,한창 유행이였을 때 GS<b>편의점</b>에 떡하니 있길래 가격도 안보고 사 먹었는데 9천원 후반대였음 덜덜 ; 맛은... 아 그리고 <b>신상</b> 떡꼬치도 나왔는데 됸맛탱 ..❤️그것은 뒤에 나올 예정ㅋ 대천 놀러가기 전에인가 ..... ,"Happy, Daily",https://blog.naver.com/alsgml250/224142519760,편의점 신상 먹방,naver_blog
1.0,20260111,2026-01-11,"타야스 투바나 초콜릿 후기｜13초의 기적, 최근 품절 대란을... ",#타야스 #타야스초콜릿 #투바나초콜릿 #대용량초콜릿 #트레이더스추천 #초콜릿간식 #수입초콜릿 #발렌타인데이초콜릿 #사무실간식추천 #간식추천 #초콜릿후기 #<b>디저트</b>추천 #해외초콜릿 #<b>요즘핫한</b>초콜릿... ,먼끼는 항상 놀라워,https://blog.naver.com/amazingdust/224142943910,요즘 핫한 디저트,naver_blog
1.0,20260111,2026-01-11,"음식_두바이 쫀득쿠기 구매 후기, 잠실 팝업스토어 FORE FORE",#맛있는음식 #두바이쫀득쿠기 #후기 #잠실롯데팝업스토어 #두쫀쿠 #줄서서먹는<b>디저트</b> #FOREFORE... 곳인데 <b>요즘 핫한</b> 두바이 쫀득쿠키도 역시 맛있게 만드네요 개별 케이스로 포장 되어 있고 두쫀쿠 가격은 7... ,초고봉님의 블로그,https://blog.naver.com/bagoppayo/224142934785,요즘 핫한 디저트,naver_blog
1.0,20260111,2026-01-11,MBTI별 엄마 특징&amp;MBTI별 간식 취향 &amp;MBTI별 짝사랑 특징,"아무거나 → <b>편의점</b> 스낵류 ESTP – <b>먹방</b> 가능 → 치킨너겟, 감튀, 버거까지 간식 취급 ESFP – 인스타 감성 디저트 → 크로플, 버블티 ENFP – <b>신상</b> 간식 도전... ",스무살 학생 권예원,https://blog.naver.com/bjognomeeld/224142069302,편의점 신상 먹방,naver_blog
1.0,20260111,2026-01-11,홍성 카페 내포 크림하우스 두바이 초코 소금빵과 파블로바... ,"소금빵의 변신, 화려한 <b>디저트</b> 라인업 진열되어 있는 메뉴들을 보니 정말 눈이 돌아가더라고요. <b>요즘</b> 가장 <b>핫한</b> 두바이 쫀득 쿠키부터 두바이 초콜릿 소금빵은 물론이고, 카이막 소금빵, 생크림 딸기 소금빵 등... ",제이디의 소소한 일상,https://blog.naver.com/black_won/224142926941,요즘 핫한 디저트,naver_blog
