days_ago,postdate,post_date,title,description,bloggername,link,query,source
1.0,20260111,2026-01-11,"2026년 1월, 수능 끝! 서울에서 꼭 가봐야 할 인기 여행지... ","성수동 – <b>요즘</b> 가장 <b>핫한</b> 카페 &amp; 팝업 거리 성수는 2026년 현재에도 가장 <b>핫한</b> 동네 중 하나로, 팝업스토어·전시·<b>디저트</b> 카페 등이 몰려 있어 걸어 다니다 보면 시간이 훌쩍 지나 있어요. 키워드: 성수동 카페... ",In Varietate Concordia,https://blog.naver.com/carlovetw/224142973245,요즘 핫한 디저트,naver_blog
1.0,20260111,2026-01-11,용산 아이파크몰 팝업부터 카페까지! 놓칠 수 없는 놀거리,"<b>요즘</b> 주말이나 평일에 어디 가지? 하고 고민하는 분들 정말 많으시죠? 저는 상담하면서도 이런 질문... 아우어베이커리처럼 맛있는 빵과 커피로 유명한 곳부터, '적당'처럼 고즈넉한 한옥 분위기에서 <b>디저트</b>를... ",누워서 쉽게 슬림해지는 곳 :: ESD 목동점,https://blog.naver.com/cc76604/224142684841,요즘 핫한 디저트,naver_blog
1.0,20260111,2026-01-11,마라뿌린 치킨팝 CU <b>편의점 신상</b> 과자 칼로리 씨유 맥주 안주... ,마라뿌린 치킨팝 CU <b>편의점 신상</b> 과자 씨유 간식 칼로리 간단한 맥주 안주 추천 마라뿌린 치킨팝 ⓒ 달코미의 <b>먹방</b> 다이어리 안녕하세요! 달코미에요 :) 오늘은 간단한 맥주 안주 과자로 추천드리는 CU <b>편의점</b>... ,달코미의 먹방 다이어리,https://blog.naver.com/cottoncandy_123/224142665988,편의점 신상 먹방,naver_blog
1.0,20260111,2026-01-11,<b>요즘</b> 대세 <b>핫한</b> 두바이쫀득쿠키 두앤두 두바이 쫀득쿠키 팝업... ,괜찮았어요 <b>요즘</b> 유행하는 <b>디저트</b>답게 젊은 층은 물론이고 어른들 입맛에도 잘 맞을 것 같아요 대구에서 <b>핫한 디저트</b> 팝업 찾고 있다면 두앤두 두바이 쫀득쿠키는 한 번쯤 꼭 맛보길 추천해요 두앤두 두바이... ,수달잉의 요리조리 일상 투어,https://blog.naver.com/cvb5692/224142946122,요즘 핫한 디저트,naver_blog
1.0,20260111,2026-01-11,&lt;여수 미평동 <b>디저트</b>&gt; <b>디저트</b> 맛집 추천 또오넛 <b>요즘 핫한</b>... ,<b>요즘</b> 진짜 핫하다는 두바이 쫀득 쿠키(두쫀쿠) 먹으러 여수 미평동에 있는 또오넛에 다녀왔어요. 다들... 여수<b>핫한디저트</b> #여수신상<b>디저트</b> #여수카페투어 #여수간식 #여수<b>디저트</b>추천 #여수카페추천 #여수일상... ,everychapter_님의 블로그,https://blog.naver.com/everychapter_/224142941987,요즘 핫한 디저트,naver_blog
1.0,20260111,2026-01-11,[망원]망원동 느좋 감성카페/두쫀쿠맛집/딸기케이크 <b>디저트</b>맛... ,"커피와 <b>디저트</b> 및 칵테일과 맥주, 와인을 즐길 수 있는곳! ➕ <b>요즘 핫한</b> 두바이 쫀득쿠키 보유카페 상주견이 있어 애견동반이 가능하며 작업하기 좋은 환경과 콘센트 시설도 잘 갖춰져 있는 망원 ‘올위크’... ",애짱's Daily Note,https://blog.naver.com/gae_murmur/224142962176,요즘 핫한 디저트,naver_blog
1.0,20260111,2026-01-11,내 인생에서 먹은 것 중 제일 맛있었던 라망시크레,<b>요즘 핫한</b> 흑백요리사2의 손종원 셰프의 라망시크레에 다녀왔다. 흑백요리사를 보고 간 건 아니고... 와 이것도 또 먹고싶은 메뉴 솔잎 라임이 들어간 <b>디저트</b>였던 것 같다. 메뉴 하나하나 먹다보니 배가 불렀는데... ,사부작 유해온,https://blog.naver.com/haeiyu_/224142935218,요즘 핫한 디저트,naver_blog
1.0,20260111,2026-01-11,마곡 두바이쫀득쿠키 <b>디저트</b> 카페 추천 카페드크레프트 두쫀쿠... ,쩨나입니다 오늘 준비한 포스팅은 바로바로 요즘 엄청 핫한 두바이쫀득쿠키 일명 두쫀쿠 후기를... 디저트 카페로 핫한 곳이라 다음엔 빵 도전해볼래요 ✔️솔직히 두쫀쿠...  <b>요즘 핫한 디저트</b>라 궁금하니까... ,쩨나의 하루일기,https://blog.naver.com/hmws529831/224142979486,요즘 핫한 디저트,naver_blog
1.0,20260111,2026-01-11,메타몽처럼 살고싶다 (2025.12.29~2026.01.04),아주 <b>핫한</b> 저녁이었습니다 (아영언니의 밸런스게임 절대 끝나지 않음) 아 즐거워 12/30 (화) <b>요즘</b> 너무... 고구마 휘낭시에~ <b>요즘</b>은 고구가 <b>디저트</b>가 글케 맛있더라 달달하이 기분 좋아지고 퍽퍽하이 적당히 목... ,어서오시죠 오죠사마,https://blog.naver.com/hosy0318/224142939549,요즘 핫한 디저트,naver_blog
1.0,20260111,2026-01-11,카플 CPWireless 무선 애플 카플레이 동글 추천 - 아이폰... ,수제 만드는 법 고소함의 끝판왕 <b>요즘</b> 인터넷이나 SNS를 보면 가장 <b>핫한 디저트</b>가 무엇인지 바로 아실 거예요. 바로 두바이 스타일의 초콜릿과 쿠키들이죠! 특유의 고소한 맛과 바삭한 식감 때문에 많... ,잔잔한 수익의 바다,https://blog.naver.com/hotsod02/224142932104,요즘 핫한 디저트,naver_blog
1.0,20260111,2026-01-11,"New Year, 2026 !",가냐면요 <b>편의점</b> 알바 면접! 매장 한번 쓱 둘러보는데.. 먹고 싶은 <b>신상</b>이 너무 많아서 눈돌아간다...... <b>편의점</b> 세개와 개인카페 두 곳의 두쫀쿠를 가져다줬다 크크크 갑자기 왜이러지?  <b>먹방</b> 유투버 처럼... ,사랑의 시선,https://blog.naver.com/jane314/224142878924,편의점 신상 먹방,naver_blog
1.0,20260111,2026-01-11,인천맛집 용가회전훠궈 구월동 무한리필 웨이팅 꿀팁,"저는 <b>요즘</b> SNS에서 <b>핫한</b> 건희소스와 제 취향을 담은 고수+즈마장+다진마늘 두 가지를 만들어서... <b>디저트</b>까지 완벽한 풀코스 마무리 제한 시간 90분을 꽉 채울 정도로 배부르게 먹었지만, 후식을 포기할 순 없죠!... ",마구마구 올리는 기록로그,https://blog.naver.com/kimmmeh/224142973010,요즘 핫한 디저트,naver_blog
1.0,20260111,2026-01-11,광안리 구움과자 맛집 추천 <b>디저트</b>선물세트 베이크꼼마,"휘낭시에만 해도 10가지가 넘어거 고르는데 한참 고민했어요 ,,, 위에 토핑도 가득 올라가 있어서 비주얼부터 이미 합격 ✨ <b>요즘 핫한</b> 두바이 <b>디저트</b>도 빠질 수 없죠! 베이크꼼마에도 두바이 초코 휘낭시에가... ",Kongg,https://blog.naver.com/kkong222_/224142951323,요즘 핫한 디저트,naver_blog
1.0,20260111,2026-01-11,"대전에서 <b>요즘</b> 가장 <b>핫한 디저트</b>, 두쫀쿠 맛보셨어요?","솔직히 말해서, <b>요즘</b> <b>디저트</b> 종류가 정말 다양하잖아요. 그런데도 대전 두쫀쿠가 이렇게까지 사랑받는 데는 다 이유가 있더라고요. 단순히 달기만 한 게 아니라, 쫀득함과 바삭함의 조화가 정말 예술이에요.... ",여행의 참맛을 느끼며,https://blog.naver.com/lover_je/224142964264,요즘 핫한 디저트,naver_blog
1.0,20260111,2026-01-11,세븐일레븐/카다이프쫀득볼/핫템쇼핑/편의점<b>디저트</b>,이이 <b>핫한 디저트</b> 두쫀쿠가 있는 거에요! 내심 궁금했지만 핫하다길래 가면 없겠지 싶어 생각만... 어쩌다 한번 정도는 먹을 수 있을 것 같아요~ <b>요즘</b> 요거 파는 <b>디저트</b>숍들도 많던데 다른 가게들 두쫀쿠는 또... ,라탄앤조이 : Rattan&Joy,https://blog.naver.com/min810324/224142929989,요즘 핫한 디저트,naver_blog
1.0,20260111,2026-01-11,[마곡/마곡나루] 가루 날림 없는 두쫀쿠 맛집 '카페드크래프트... ,com/mine_y_ours/224139796711 + 생각이상으로 맛있는 <b>편의점</b> 두바이수건케이크  https://blog.naver.com/mine_y_ours... 디저트<b>신상</b> #<b>신상</b>디저트 #먹킷리스트 #서울디저트맛집 #강서구디저트 #방문후기 #구매성공... ,맛집 찾아 뽈뽈,https://blog.naver.com/mine_y_ours/224142328893,편의점 신상 먹방,naver_blog
1.0,20260111,2026-01-11,베이크샵 수하 (부제:두쫀쿠를 찾아서),왜냐면 <b>요즘</b> 유행하는 두바이쫀득쿠키를 먹어봤거든요. 두쫀쿠사냥꾼의 포스팅 스따뜨  베이크샵... 토요일 네시쯤 방문했는데 케이크하나랑 두쫀쿠 외에 <b>디저트</b> 소량 있었어요. ◼️가게내부◼️ 가게내부... ,은둥이네,https://blog.naver.com/minieunji94/224142956510,요즘 핫한 디저트,naver_blog
1.0,20260111,2026-01-11,느좋 잠실카페 뵈르앤코 후기,뵈르앤코 <b>디저트</b> 라인업 #석촌역카페 #빵지순례 #잠실카페 #잠실느좋카페 #석촌호수카페 #잠실예쁜카페... 추천 <b>요즘 핫한</b> 두바이 초코 소금빵도 먹어볼까 했눈데 이 날은 고구마가 더 땡기더라구요. 완전... ,다람쥐부인의 리뷰 모음.zip,https://blog.naver.com/mrs-squirrel/224142934219,요즘 핫한 디저트,naver_blog
1.0,20260111,2026-01-11,[코스트코 푸드코트 추천] 1월 신메뉴부터 클래식까지! 꼭... ,"2026년 1월 현재 가장 <b>핫한</b> 메뉴들, 지금 바로 리뷰 시작할게요! 1. 코스트코의 영원한 클래식, 불고기... 겉바속촉 <b>디저트</b>, 츄러스 &amp; 가성비 음료 #코스트코 #코스트코푸드코트 #코스트코추천메뉴 식사의 마무리는... ",운명을 읽는 온라인건물주,https://blog.naver.com/nana1004k/224142937621,요즘 핫한 디저트,naver_blog
1.0,20260111,2026-01-11,"신라면 골드 후기, 이래서 인기? 존맛탱구리",편] #내돈내산후기 #라면<b>먹방</b> #골드빛깔 #비주얼갑 #<b>신상</b>리뷰 #면치기 #밥말아먹기필수 #<b>편의점신상</b> #K라면 #먹스타그램 #오늘의야식 #라면덕후 #신라면의변신 [꿀팁 및 조합 편] #후첨조미유필수... ,천상천하유아독존,https://blog.naver.com/nobbakku777/224142702629,편의점 신상 먹방,naver_blog
1.0,20260111,2026-01-11,안유진·장원영도 반한 ‘두쫀쿠’ 열풍! 내겐 너무 까칠한... ,이번 방송에서는 아이브(IVE)의 안유진과 장원영이 출연해 역대급 '<b>먹방</b>' 케미를 보여줬는데요. 특히 두... 아이브간식 #피스타치오쿠키 #카다이프쿠키 #금요예능 #디저트추천 #<b>편의점신상</b> #줄서는맛집 #인생쿠키,드라마 패션 맛집,https://blog.naver.com/northpol-/224141665339,편의점 신상 먹방,naver_blog
1.0,20260111,2026-01-11,대구 봉산동 두쫀쿠 치아바타 맛집 l 베어베이커스,두쫀쿠 원픽 l 치아바타 맛집 대구 봉산동 베어베이커스 베어베이커스는 <b>요즘 핫한</b> 두쫀쿠와 120시간... 연유를 쓰신건지 뭔가 달달한 향이 올라와서 커피랑 곁들이니 <b>디저트</b>로 진짜 딱이었어요. 5. 구매 방법... ,k줌마 박여사답게,https://blog.naver.com/odtion88/224142964128,요즘 핫한 디저트,naver_blog
1.0,20260111,2026-01-11,GS<b>편의점</b> 두바이쫀득초코볼 솔직 후기 가격·맛 비교,GS<b>편의점신상</b> #<b>편의점</b>디저트 #<b>편의점</b>간식 #<b>편의점</b>추천 #디저트후기 #솔직후기 #쫀득쿠키 #피스타치오디저트 #카다이프 #단거주의 #<b>신상</b>과자 #<b>편의점</b>리뷰 #두바이디저트 #내돈내산 #간식추천 #디저트덕후 #<b>먹방</b>후기,파주파파의 일상,https://blog.naver.com/pajupapa123/224142289178,편의점 신상 먹방,naver_blog
1.0,20260111,2026-01-11,푸꾸옥야시장,"부이페스트 야시장 후기 부이페스트 야시장은 <b>요즘</b> 가장 <b>핫한</b> 신상 야시장이에요.남부 선셋타운 근처에... 해산물, 꼬치, 열대과일 <b>디저트</b>까지 메뉴도 다양하고 전체적인 가격은 살짝 있는 편이지만 우리나라... ",틈만나면 떠나님의 블로그,https://blog.naver.com/purier28/224142933679,요즘 핫한 디저트,naver_blog
1.0,20260111,2026-01-11,"두쫀쿠 맛집 파는곳, 쫀득한 행복을 찾는 여정!","요즘 디저트 좀 즐긴다 하는 분들이라면 한 번쯤 들어보셨을 이름, 바로 두쫀쿠예요. 겉은 쫀득하고... 쫀득한 행복을 위한 제안 오늘은 <b>요즘 핫한 디저트</b>, 두쫀쿠에 대해 여러 이야기를 나눠봤어요. 쫀득함과... ",당신에게 도움이 되는 블로그 -당도블,https://blog.naver.com/richroy7/224142976626,요즘 핫한 디저트,naver_blog
1.0,20260111,2026-01-11,1월 첫째 주 일상,언냐의 구구바 <b>먹방</b> 직관하기 또이소 갈 겸 쓰레기두 버려용 달이 엄청 컸는데 역시 안담겨잉 옛날... 트리 <b>편의점</b>에서 잠깐 <b>신상</b> 구경구경구 스레드에서 오일 파스텔 프롬프트 발견해서 돌렸는데... ,또나의 일상기록,https://blog.naver.com/seonhabss/224142746524,편의점 신상 먹방,naver_blog
1.0,20260111,2026-01-11,김해 부원동 오모스 카페 김해시청 근처 <b>디저트</b>맛집,"* 주차는 카페 건물 내 지하주차장에 1-2대 정도 가능하다고 하며, <b>디저트</b> 및 음료 주문 후 테이크아웃... 최근에는 두바이 쫀득쿠키도 판매중이셔서 김해두쫀쿠맛집으로 또 명성을...!!ㅎㅎ <b>요즘</b> 제법 <b>핫한</b> 느낌... ",Day By Day✨,https://blog.naver.com/shapley11/224142978641,요즘 핫한 디저트,naver_blog
1.0,20260111,2026-01-11,시흥시 정왕동 오이도역 카페 엔그리고 두바이 쫀득쿠키... ,안녕하세요 시흥시 정왕동 오이도역근처 디저트 카페 엔그리고 입니다. 대란 중에 대란 두바이쫀득쿠키 모르시는 분들이 없을 정도로 <b>요즘 핫한 디저트</b>이지요. 엔그리고에서도 두바이 쫀득쿠키가 최근... ,"엔,그리고",https://blog.naver.com/sm2tj/224142970514,요즘 핫한 디저트,naver_blog
1.0,20260111,2026-01-11,GS25 성수 베이글 크림치즈 내돈내산 후기,<b>편의점</b>간식 #<b>편의점신상</b> #GS<b>편의점</b> #간단한아침 #아침메뉴추천 #브런치메뉴 #혼밥메뉴 #직장인간식... 대학생간식 #<b>편의점</b>리뷰 #<b>편의점</b><b>먹방</b> #빵순이 #빵돌이 #베이글덕후 #가성비간식 #간편식추천 #출근길간식... ,"맛집, 제품 찾기 달인",https://blog.naver.com/su_min_0728/224142807048,편의점 신상 먹방,naver_blog
1.0,20260111,2026-01-11,제주도 두바이 쫀득쿠키 맛집 AMA 아마 웨이팅 가격 후기,JEJU AMA <b>요즘 핫한</b> 두바이 쫀득 쿠키 애월에 있는 AMA <b>디저트</b> 맛집에서는 꼭 두바이 쫀득쿠키를 먹어봐야 한다란 얘길 들어서 주말에 방문해봤어요 두쫀쿠 맛 궁금증에 이끌려 결국 AMA를 찾아갔답니다. 오늘은... ,줄리다이어리♥,https://blog.naver.com/unique1028/224142978151,요즘 핫한 디저트,naver_blog
1.0,20260111,2026-01-11,두바이쫀득쿠키 팝업 스토어 일정 두앤두 두쫀쿠 솔직 후기,<b>요즘</b> 가장 <b>핫한 디저트</b> 중 하나인 두바이쫀득쿠키! 그중에서도 피 얇고 카다이프랑 피스타치오가 꽉 차 있어서 정말 맛있게 먹었답니다! 오늘도 두쫀쿠 하세요~~~ #두쫀쿠 #두바이쫀득쿠키 #두앤두 #두쫀쿠후기... ,내맘대로 뚜레블,https://blog.naver.com/wlsrud8541/224142926300,요즘 핫한 디저트,naver_blog
2.0,20260110,2026-01-10,CU<b>신상</b>디저트 두쫀떡 구매후기 (카다이프초코 쫀득찹쌀떡),"<b>편의점</b> 들어갔는데 사장님이 두쫀떡 정리하고 계셨어요. 2개 입고된 거 싹쓰리하고, 두바이쫀득마카롱도 있길래 같이 샀어요! 너무나 신난 남편 상구링과 나 ✔️두쫀떡 <b>먹방</b> 후기 CU에서 판매중인... ",백돌핀 어드벤쳐,https://blog.naver.com/100_dolphin/224141992262,편의점 신상 먹방,naver_blog
2.0,20260110,2026-01-10,12/32,오렌지초코쿠키 <b>신상</b>이라길래 먹엇는데 제주도감귤초콜릿맛임 그녕그랫어요 이거제최애빵입니다... 아니 누가 판매하는 가나디우유에 눈썹문신해줌 근데 1/3에 <b>편의점</b> 다시갔는데 저 우유만 안팔리고 덩그러니... ,•••,https://blog.naver.com/510ye0n/224141188655,편의점 신상 먹방,naver_blog
2.0,20260110,2026-01-10,하려고 마음먹었으면 해야지 근데 마음먹는게 쉽지 않으면 어떡해,그리고 이번에 서빙스푼도 <b>신상</b>으로 나왔거든요? <b>먹방</b>하시는 분들이 쓰는거 보고 조아보였지만 한개... 너무 잘 샀죠 논란의 <b>편의점</b> 두쫀쿠 이건 이마트24꺼에요 제가 먹어볼게요 이거 어떻게 먹어야... ,･ ｡ﾟ★: *.✦ .* :★. ｡ﾟ,https://blog.naver.com/579642/224141618164,편의점 신상 먹방,naver_blog
2.0,20260110,2026-01-10,CU <b>신상</b> 두바이디저트 역대급 화제인 카다이프 마카롱과... ,(씨유 동편마을점에서 구매함ㅋ) 평소 <b>편의점 신상</b> 털기를 즐겨 하신다면 카다이프라는 생소한 이름이 낯설지 않으실 텐데요. 특히 <b>먹방</b> 유튜버 돼끼님이 극찬했던 바로 그 카다이프 쫀득 마카롱 때문에 CU를... ,오깜하우스,https://blog.naver.com/5ggam_v/224141635974,편의점 신상 먹방,naver_blog
2.0,20260110,2026-01-10,GS 용사라면 솔직 후기 _ 잊고 지내다 우연히 만난 전설의... ,파랑버섯 #전설의파랑버섯 #메이플몹 #메이플추억 #GS<b>편의점</b> #GS<b>편의점신상</b> #<b>편의점</b>라면 #<b>편의점신상</b>라면 #컵라면추천 #전자레인지라면 #전자레인지조리 #<b>편의점</b><b>먹방</b> #<b>편의점</b>후기 #라면후기 #솔직후기,잡동사니,https://blog.naver.com/cielissky58/224141079109,편의점 신상 먹방,naver_blog
2.0,20260110,2026-01-10,미쯔 블랙 요거트 비요뜨 GS <b>편의점 신상</b> 간식 달달한 디저트,미쯔 블랙 요거트 비요뜨 GS <b>편의점 신상</b> 간식 달달한 디저트 미쯔 요거트 ⓒ 달코미의 <b>먹방</b> 다이어리 안녕하세요! 달코미에요 :) 비요뜨 좋아하시는 분들 많이 계시죠? 오늘은 GS <b>편의점 신상</b> 간식인 미쯔... ,달코미의 먹방 다이어리,https://blog.naver.com/cottoncandy_123/224141120932,편의점 신상 먹방,naver_blog
2.0,20260110,2026-01-10,전주 한빛호텔 위치 정보 및 상세후기,전주에 새롭게 문을 연 따끈따끈한 <b>신상</b> 호텔을 소개해 드릴게요!  바로 전주 한빛호텔이에요.... 호텔로 돌아오는 길목에 <b>편의점</b>도 있어 간식 사오기도 정말 편리했어요. 전주 한옥마을 여행을 계획... ,숙소도우미,https://blog.naver.com/happyhello09/224141444528,편의점 신상 먹방,naver_blog
2.0,20260110,2026-01-10,[CU] 씨유 <b>편의점 신상</b> 두바이 카다이프 쫀득마카롱 내돈내산... ,1월 8일에 샀는데 11일까지임 씨유 두바이 마카롱 칼로리는 153kcal ㅎㅎ 오늘의 <b>편의점</b> 두바이 디저트 <b>먹방</b> 씨유 카다이프 쫀득 마카롱 입니당~~ (카다이프 쫀득 마카롱 내돈내산 솔직 후기) 위에서 보면... ,"수둑이와 함께하는 카페, 맛집 산책",https://blog.naver.com/hellomarmot/224141695243,편의점 신상 먹방,naver_blog
2.0,20260110,2026-01-10,[제품리뷰] 찐 두바이초콜릿 픽스초콜릿 피스타치오 먹어봤어요,간식추천 #<b>신상</b>초콜릿 #<b>신상</b>간식 #초코덕후 #피스타치오덕후 #디저트리뷰 #디저트스타그램... 이색간식 #<b>편의점</b>초콜릿 #수입과자 #초콜릿간식 #내돈내산 #리얼후기 #초콜릿<b>먹방</b> #간식타임 #달콤한시간... ,일기장,https://blog.naver.com/hison93/224141253700,편의점 신상 먹방,naver_blog
2.0,20260110,2026-01-10,25년 3개월 돌아보기 (1월~3월),유정이랑 산책하다가 <b>편의점</b> 들렷는데 <b>신상</b> 잇길래 사먹었던고오 3월 6일 나 이 셀카 빛반사가... 래오의 야무진 참치 <b>먹방</b> 아 표정 ㅋㅋ 너무 띨롱해 ㅋㅋ &quot; 나는 눈나 품이 젤 조아욘.. &quot; 3월 19일 오늘두... ,널 만난건 나에게 큰 행운이야,https://blog.naver.com/hyun_s13/224141654492,편의점 신상 먹방,naver_blog
2.0,20260110,2026-01-10,딸기크림맘모스빵 <b>먹방</b> 솔직 후기 ㅣ CU<b>편의점 신상</b> ㅣ 가격... ,"연세우유 딸기크림맘모스빵 이번 겨울, 딸기 시즌에 한 번쯤은 꼭 먹어보시길 추천드립니다 #연세우유 #연세우유딸기크림맘모스빵 #2026<b>신상</b> #<b>편의점</b>리뷰 #<b>편의점신상</b> #딸기디저트 #맘모스빵 #돼지바맛... ",J로그,https://blog.naver.com/jdaily_032/224141712908,편의점 신상 먹방,naver_blog
2.0,20260110,2026-01-10,CU<b>편의점</b> 가성비 두쫀쿠 카다이프초코 쫀득찹쌀떡,#CU<b>편의점</b> #두쫀쿠 #CU<b>신상</b> #<b>편의점신상</b> #<b>편의점</b>간식 #<b>편의점</b>추천 #CU추천 #간식추천 #쫀득간식 #달달한간식 #<b>편의점</b>디저트 #간식리뷰 #<b>편의점</b><b>먹방</b> #<b>신상</b>간식 #디저트맛집,행복한 곤주의 세상 여행,https://blog.naver.com/leeyh224/224141831396,편의점 신상 먹방,naver_blog
2.0,20260110,2026-01-10,"<b>편의점</b> 두쫀쿠, 어디서 구매해야?? 후기",[세트 1: <b>신상</b> 디저트 인증샷용] #두쫀쿠 #<b>편의점신상</b> #CU<b>신상</b> #<b>편의점</b>디저트 #두툼하고쫀득한쿠키... 맛스타그램 #<b>먹방</b> #Dessert #Cookie [세트 3: 재고 찾기 &amp; 정보 공유용] #포켓CU #재고조회 #<b>편의점</b>투어... ,천상천하유아독존,https://blog.naver.com/nobbakku777/224141926397,편의점 신상 먹방,naver_blog
2.0,20260110,2026-01-10,"노브랜드 추천상품, 요즘 이런게???","직화 곱창 / 막창 왜 의외인가?: <b>편의점</b> 안주보다 양은 훨씬 많고, 전문점 수준의 불맛이... 노브랜드<b>신상</b> #득템성공 #스마트컨슈머 [세트 2: <b>먹방</b> &amp; 혼술 안주용] #노브랜드칠리새우 #노브랜드닭꼬치... ",천상천하유아독존,https://blog.naver.com/nobbakku777/224141928467,편의점 신상 먹방,naver_blog
2.0,20260110,2026-01-10,GS25 <b>편의점 신상</b>｜두쫀쿠 두바이 쫀득 초코볼 두쫀볼 먹어본... ,두쫀볼 #두쫀쿠 #<b>편의점신상</b> #<b>편의점</b>디저트 #<b>편의점</b>초콜릿 #피스타치오디저트 #두바이초콜릿 #GS25디저트 #<b>편의점</b>간식추천 #<b>편의점</b>리뷰 #솔직후기 #<b>신상</b>리뷰 #디저트후기 #<b>편의점</b><b>먹방</b> #유행템 #칼로리폭탄,샘샘의 맛있는 하루｜리얼맛집 리뷰 기록장,https://blog.naver.com/saem2y/224140976522,편의점 신상 먹방,naver_blog
2.0,20260110,2026-01-10,"오키나와 미야코지마, 새벽 라멘까지 5차 <b>먹방</b> 릴레이 미식... ",숙소보다 <b>먹방</b>이 우선 본격적인 <b>먹방</b> 1차전이 시작됐습니다. 한국어 메뉴판이 있는 꽤 넓은... <b>편의점</b>은 필수 코스 식당을 나선 후에도 귀가하는 대신 마트에 들러 무언가를 챙겨갔다는 사실! 잠시... ,엄마루팡,https://blog.naver.com/wldms4272/224141336801,편의점 신상 먹방,naver_blog
2.0,20260110,2026-01-10,두쫀쿠 열풍! 집에서도 이 가격으로? 사장님들 '화들짝' 놀란 이유,"나누면서, 소소한 재미를 느껴보고 싶답니다. 다들 오늘 하루도 맛있는 디저트와 함께 행복한 시간 보내시길 바라요! #두쫀쿠 #두바이초콜릿 #디저트맛집 #<b>편의점신상</b> #가성비디저트 #오픈런 #트렌드 #<b>먹방</b>",세상에 WoW,https://blog.naver.com/wow_365/224141333011,편의점 신상 먹방,naver_blog
2.0,20260110,2026-01-10,침착맨과 콜라보한 롯데리아 통다리 크리스피 치킨버거 후기... ,<b>편의점</b>에서 햄버거 사먹는게 더 만족스러운것 같기도. 단면은 이러하다! 버거가 여기 주력인데 어째서... 그릭랜치맛 #<b>신상</b>버거 #치킨버거 #버거리뷰 #패스트푸드 #햄버거추천 #신메뉴 #<b>먹방</b> #솔직후기 #버거맛집... ,지오의 건강한 몸 마음 그리고 삶의 기록,https://blog.naver.com/zioo602/224141801516,편의점 신상 먹방,naver_blog
3.0,20260109,2026-01-09,두바이 쫀득쿠키 세븐일레븐 쫀득볼 GS 두쫀쿠 <b>편의점 신상</b> 비교,두바이 쫀득쿠키 세븐일레븐 쫀득볼 GS 두쫀쿠 <b>편의점 신상</b> 비교 두바이 쫀득쿠키 ⓒ 달코미의 <b>먹방</b> 다이어리 안녕하세요! 달코미에요 :) 요새 푸드 트렌드 이야기할 때 빼놓을 수 없는게 바로 두쫀쿠인 것... ,달코미의 먹방 다이어리,https://blog.naver.com/cottoncandy_123/224139822614,편의점 신상 먹방,naver_blog
3.0,20260109,2026-01-09,"세븐일레븐 두바이 쫀득 쿠키, 쫀득볼 재고 찾기 꿀팁 대방출!","'두쫀쿠'라는 친근한 줄임말과 함께 인스타그램, 틱톡 등에서 <b>먹방</b> 및 리뷰 영상이 쏟아지며 하나의... #세븐일레븐두바이쫀득 #두쫀쿠 #카다이프쫀득볼 #<b>편의점신상</b> #세븐일레븐디저트 #두바이쫀득가격... ",좋은내용,https://blog.naver.com/happyrich1591/224137388494,편의점 신상 먹방,naver_blog
