score,video_id,title,channel_title,published_at,viewCount,likeCount,commentCount,description
3917.6901027956274,VPGq0Q_hIMw,대전 사람들 다 둔산동 모였나 사람 미어터지는 술집,대전공주 공주픽,2026-01-08 10:11:47+00:00,23737,19,5,07년생 안주서비스 팍팍 준다는데?   동백야시장 (대전 서구 둔산동 1048) ⏰ 매일 17:00-10:00 ☎️ 0507-1354-0345 ⭐️둔산 ...
3809.9208771745166,ZZ4GPBAr_-0,점점 너프하는~ 올해 마지막 편의점 신제품 리뷰,맛상무,2025-12-28 03:19:31+00:00,83128,1701,259,koreanfood #편의점 #딸기 이마트24 - 타코스타일 버거 4500원 CU - 맛폴리 미니버거플래터 8900원 - 퓨전한상 카츠김치나베 6900 ...
3789.5075582602826,wOlSXGJmUlI,최고급 특별 부위만 가져와 특이하게 구워냈더니... 비싸도 줄 서서 먹는다ㅣ100kg 이틀이면 다 팔린다는 소고기집ㅣ우대갈비ㅣ극한직업│#골라듄다큐,EBSDocumentary (EBS 다큐),2025-12-21 10:01:36+00:00,133015,570,129,"이 영상은 2024년 9월 28일에 방송된 ＜극한직업 - 고물가 생존 전략, 소고기로 승부한다!＞의 일부입니다. 짚불 향이 가득한 '우대 ..."
3680.718630878582,fV_whKUwGqs,농심 40주년! 역대급 신상 신라면 골드!,조정현,2026-01-10 06:00:43+00:00,10693,85,7,먹방 #조정현 #라면 #신메뉴 비즈니스 문의:henry@hrgroup.network.
3627.421208790457,fQFOXP7JgyE,요즘 제일 자주오는 문의?,사맛디디저트,2026-01-06 04:03:06+00:00,32688,486,19,
3551.5469817407497,XDl8HfVA-fk,요즘 금값인 피스타치오 쏟아부은 이 디저트의 정체 [갓나온 맛도리 EP.158] / 스브스뉴스,스브스뉴스 SUBUSUNEWS,2025-12-24 09:01:01+00:00,105454,792,97,"'천상의 맛이에요' '한국에서 유행하면 대박 날 것 같아요' 드디어 한국에 들어온 튀르키예 디저트, 로쿰&바클라바 국내 1호 로쿰 ..."
3477.712384888869,A_NfMg2ASr4,신상 맛집이 아닌...폐업 3개월 남은 매장 먹어보고 말씀드리겠습니다!,다비교,2026-01-02 09:00:16+00:00,50040,922,38,
3367.5814147033066,0l5VjhbSDF4,New Korean CVS food 🇰🇷 Bear jelly ASMR,choa asmr,2025-12-31 14:43:30+00:00,57340,1029,23,mukbang #conveniencestore #asmr #shortsviral #koreanfood #koreanconveniencestore #편의점신상 #편의점먹방 #젤리먹방.
3303.7376356149057,kAzZFn55Ycc,편신~반숙 간장밥이야~ #편의점신상간편식 #편의점신상삼각김밥 #반숙간장밥,존맛맨,2026-01-07 02:03:04+00:00,26762,115,3,
3252.6884541279355,yVqfzYfkNLA,옆나라에서 유행중인 요거트로 치즈케이크 만들기,서송자,2026-01-09 04:07:59+00:00,15432,52,0,요즘 난리라는 디저트 만들어봄 요거트랑 빠다코코넛으로 만드는 치즈케이크가 또 유행이길래 맛이 넘 궁금해서 만들어봤어요 !
3223.0295268071677,mEJTH6VWk84,알고리즘으로 난리난 두찜신상🔥 한우대창맵닭발 먹방 #mukbang #asmr,쑤의 심야밥상,2026-01-11 03:01:05+00:00,4974,21,2,
3192.3711370448204,Vr1M1ny3KzE,성공하면 상위 1% #단어리듬게임 #리듬게임 #namethething,이서현 SH LEE,2025-12-18 05:52:34+00:00,127356,721,14,
3158.1674281616397,Eae_vpz0iKU,국밥보다 비싼 두바이초코 와플🧇,모닝이 morningeee,2025-12-22 08:00:17+00:00,101586,1075,43,리뷰 #신상 #카페인중독 #간식추천 #와플 #두바이초콜릿 #디저트 #꿀고구마와플 #shorts.
3112.640548617272,HRL2I8Wdy88,두바이쫀득쿠키는 사드세요..직접만든 두바이쫀득쿠키 먹방🍫Dubai Chewy Cookies Mukbang ASMR,애정 Aejeong,2025-12-23 03:01:42+00:00,86282,2209,26,안녕하세요 애정입니다 오늘은 요즘 유행하는 두바이쫀득쿠키를 직접 만들어서 먹어봤어요! 요즘 워낙 많이 보이기도 해서 어떤 맛 ...
3108.305533650396,8_Q0nNt6pd8,빌딩 샌드위치 식당의 정체,와우팡,2026-01-10 13:28:59+00:00,7669,27,2,"일반 음식의 10배~50배 크기! 초대형 음식만 서빙하는 레스토랑의 충격적인 현장. 세숫대야 커피, 사람 몸통만한 샌드위치, 화분 크기 ..."
2967.0853877652453,RRzWtdJOhjw,신상인데 아무도 모름. 편의점 간식 3가지,모닝이 morningeee,2026-01-01 07:00:22+00:00,49048,569,17,리뷰 #신상 #간식 #추천 #통크 #통크리뉴얼 #미쯔 #미쯔비요뜨 #마라뿌린치킨팝 #치킨팝 #shorts.
2870.1832315667775,6YJYwi2eDgE,요즘 저렴한 한식당 보기 어려운 이유,바나나배꼽,2026-01-06 00:24:48+00:00,26959,215,57,
2864.1513851827303,TkQl24307lQ,요즘 유행하는 추성훈 스테이크 맛평가 해봤습니다,범프리카,2025-12-25 08:00:43+00:00,77242,753,222,"아프리카TV의 먹방 NO.1을 떠나, 우리나라 최고의 먹방 NO.1을 꿈꾼다. 맛집탐방, 미션방송 컨텐츠 방송 범프리카!"
2836.5696700938142,XKr9PEPYTSc,요즘유행 대파파스파 전자렌지ver.🤩 #간단한식단 #다이어트레시피 #초간단레시피 #간단한요리,초이쿡 | mimchoi ,2026-01-08 07:56:32+00:00,16192,197,1,
2786.6495918243554,-aZNvYDitas,대구 신년 모임은 대명동에서 😎#삼돼천왕 #대구맛집 #대구핫플 #대구삼겹살맛집 #대구가성비맛집 #대명동맛집 #서부정류장맛집 #대구삼겹살,대구핫플여기 대구맛집,2026-01-08 07:55:01+00:00,16568,110,2,
2769.8536477564867,txfwJ_pTH2E,경산 앞량사람들만 먹고있는 세수대아 만한 동죽칼국수 숟가락으로 떠먹을정도의 해물파전까지 안가면 손해인 경산핫플 칼국수! #경산맛집 #경산칼국수 #칼국수맛집 #대구근교 #유비칼국수,"젤리민의맛집,여행",2026-01-09 02:16:11+00:00,13475,32,9,
2612.833146867591,3HRlwh_iFOU,이게 요즘 유행이죠?유세윤님 따라서 트렌드탑승 #유세윤 #funny #트렌드탑승 #두쫀쿠 #허미노 #mukbang #먹방,허미노MINO,2026-01-10 09:00:07+00:00,6191,117,17,
2563.002023606548,2Z2RjKRwK8E,"국적불명 대환장 파티~손종원 뉴욕샌드, 김햄찌 브리또, 제육핫도그 12월 넷째 주 편의점 신제품 리뷰",맛상무,2025-12-21 03:45:01+00:00,78914,1395,196,koreanfood #편의점 #먹방 이마트24 - 손종원 삼각김밥2200원 - 뉴욕스타일 샌드위치4200원 CU - 치즈제육 핫도그 4000원 세븐 ...
2554.957976667285,dvrtcEvMtIs,"해외에서 유행 중? 아침에 딱 50번, 상체 고정 점프 루틴",미소 miso,2026-01-08 10:15:06+00:00,13028,247,23,해외에서 요즘 정말 핫한 아침 점핑 챌린지예요! 일어나서 15분 내로 이렇게 50번만 뛰어도 혈당이랑 체지방 관리에는 완전 직빵 ...
2539.457785243655,Ifef0-qi7UU,까먹는 호빵 모양젤리! 진짜 미니 호빵 같아요 #편의점신상 #편의점젤리,사랑아놀자(Let's Play SARANG),2025-12-16 06:13:15+00:00,104101,1081,15,
2528.8863949174383,EvurfqH1nf8,요즘 핫한 인기쟁이 라면땅✨,한닭쌤과 삐약이 교실,2025-12-16 13:08:16+00:00,102726,1037,20,
2518.1200482362437,PedWhsnhM4k,요즘 원팬 토스트 이렇게 먹는다면서요? 😋,가넷테이블 Garnet Table ,2026-01-05 10:00:46+00:00,27107,98,6,"요즘 핫한 원팬 토스트 레시피! 1팬으로 끝나는 초간단 토스트, 아침·간식·브런치 OK ✨ ✓ 재료: 계란 2개, 식빵 2조각, 버터, 치즈, ..."
2508.3397997995476,C9Imrw6dRPE,2026년 모르면 후회 할 다시 가고 싶은 부산 맛집 of 맛집 BEST6,맛찾꾼 Yummy hunter,2025-12-31 08:00:18+00:00,43904,555,28,상호 : 상해만두 전화번호 : 051-311-1151 주소 : 부산 사상구 대동로 73 상해만두 영업시간 : 11:30 ~ 21:30 휴무일 : 매주 월요일 ...
2505.138878104365,XYgADNX-QmE,품절대란!! 세븐일레븐 단독출시 생초코파이,머먹남,2025-12-24 06:00:28+00:00,73919,481,72,상호 : 전국 세븐일레븐 메뉴 생초코파이 4000원 #편의점신상 #편의점디저트 #생초코파이 #일본초코파이.
2474.567926633928,Eu3GTkAY-xU,요즘 유행하는 조합?,돌출이 ASMR,2025-12-27 08:43:21+00:00,56346,885,26,
2463.6008661644973,neHtV2yvyv4,세븐일레븐 두바이쫀득쿠키… 이 가격에 이 맛? #편의점신상 #두바이쫀득쿠키 #두바이초콜릿,와니스토리 wani_story,2026-01-08 09:01:13+00:00,14074,125,4,오늘도 시청해주셔서 감사합니다. 제품명: 카다이프쫀득볼 판매처 : 세븐일레븐 가격 : 3200원.
2458.6999221824835,KEfHFwV2E1A,"주간신상, 또 조려왔어요.",연동이네,2025-12-18 11:45:02+00:00,89457,1135,99,하2 연동이네입니다~ 오랜만에 투샷으로 돌아온 치심이네 왔어요~   크리스마스를 몇 주 앞두고 아직 까지는 연말느낌의 신상은 많이 ...
2458.6259215185096,ABZg5laMklU,여러분!! 왔어요!! 왔어요!! 두바이 쫀득 김밥 왔어요!! 😍 #두바이쫀득쿠키 #두쫀쿠 #유행 #디저트 #간식 #리뷰 #일상 #추천,Leenee 리니,2026-01-09 10:20:01+00:00,10120,78,6,
2438.694269069256,NJWAn5iYwCk,요즘 유행하는 아이스귤,톡톡팜스,2026-01-09 14:30:19+00:00,9087,107,0,"요즘 아이스 귤  유행하는거 알고계셨나요? 아이들 겨울방학 입 심심해할때, 어린 유아들 아이스크림 대용 간식, 다이어터들에게는 ..."
2386.2436158018236,qMJ90OZKF7A,12월 편의점 신메뉴 리뷰,sini시니,2025-12-22 04:25:13+00:00,72426,992,118,채널구독 Subscribe - http://bit.ly/1NhqAO6 ❤ instagram - https://instagram.com/sini_ck ❤멤버십 가입 ...
2371.100466565159,klRwVvNwFGI,헐!? 이게 맛있다고요? 😳 요즘 코스트코에서 핫한 소스👍🏻 #코스트코,살림맨,2026-01-07 11:01:33+00:00,15777,254,0,헐!? 이게 맛있다고요? 요즘 코스트코에서 핫한 소스     #코스트코 요시다 오리지날 고메 소스 ➡️ 8970원 (1.36kg) 간장·설탕 ...
2369.0329121271357,eAZetkeU4q0,요즘 유행하는 간단 치즈케이크 만들기 #food #먹방 #dessert #빠다코코낫 #에이스 #그릭요거트,밥길만걷자,2026-01-08 00:59:01+00:00,15510,42,8,
2368.8745367751835,1gZNNG8cxXc,일본 갈 필요 없는 편의점 수제 오뎅바,오눌오눌,2025-12-17 11:00:16+00:00,85182,1492,101,통통한 가래떡이라 쫀득해서 너무 맛있었던 미정당 부산식 물떡! ❤ 추운 겨울 집에서 전기장판 따뜻하게 틀어놓고 미정당 물떡에 ...
2360.7415601183657,FWDguC2meHA,요즘 핫한 멸치칼국수 10배 맛있게 끓이는 방법,오꿀오꿀,2026-01-06 06:18:28+00:00,21677,132,3,
2310.4795440792846,xcExxEYi7x8,프렌치걸이랑 요즘 유행하는 치즈케이크 만들었어요!💛 과연 그녀의 평가는…! #외국인반응 #외국인룸메,주리집 외국인,2026-01-06 08:12:22+00:00,18139,351,24,
2286.4519804191123,w4rxLJBCRJ8,"[🇯🇵 후쿠오카 Vlog #3] 두..달이나 지났잖아요... ㅣ 게으름병 ㅣ 차원이달라병 ㅣ 음주일상 ㅣ 놀거리, 관광지추천",융징낭_YZN,2026-01-10 15:40:30+00:00,53,3,3,나는야.. 게으름뱅이..ㅜㅜ #fukuoka #fukuoka #korea #vlog #후쿠오카 #후쿠오카맛집 #후쿠오카브이로그 #후쿠오카관광지 #핫플 ...
2261.7334566243444,fODE_epXadk,오세득이 &#39;그린리본&#39; 카페 주방에 직접 들어가봤습니다,오세득템,2025-12-17 09:00:00+00:00,623,50,20,"안녕하세요, 오세득입니다  ‍   오늘은 부산 마린시티 핫플 카페 '그린리본'에 방문했습니다. 샌드위치, 뇨끼, 오므라이스, 샐러드, ..."
2247.282090622701,painSz9pOk4,소주 1000원 게임하는 포차👾 #신호등포차,맛또리,2026-01-07 11:57:19+00:00,17131,0,3,홍대맛집 #홍대 #핫플추천 #핫플 #홍대핫플 #포차 #홍대술집 #홍대입구역 #핫플레이스.
2206.4841810193184,ufkcMV0KYps,하겐다즈 꺾은 진짜 1등?🍦벤앤제리스가 미친 이유,요즘난리템,2026-01-09 09:30:37+00:00,8409,132,5,"미국 아이스크림 1위 브랜드, 벤앤제리스 이젠 한국 마트와 편의점에서도 보이시죠? 하겐다즈보다 꾸덕하고 씹는 맛까지 확실한 이유 ..."
2202.8746848948967,GHuMdPUBl7w,요즘 난리 난 요거트 치즈케이크 진짜 맛있을까?,별별궁금,2026-01-06 14:00:23+00:00,18750,135,11,
2167.8608369563954,Rq_aWXaMIMk,먹대호 추천 정선 맛집ㅣ 어디든 간대호,헬로라이프,2026-01-06 06:01:07+00:00,17913,280,10,"'이야기가 있는 곳'이라면 어디든 달려가는 김대호의 생활 밀착 로컬 탐방 콘텐츠✨ LG헬로비전, the Life, Hello tv VOD에서 보실 수 ..."
2135.770071380017,dTGObJPrxPc,[EP.07] 2026년에도 유행할 음식은⁉️ 2025년 유행 음식 총정리🍽️ | 뭐하세영🤔💡,STAYC,2025-12-19 09:00:59+00:00,23132,1692,101,[EP.07] 2026년에도 유행할 음식은⁉️ 2025년 유행 음식 총정리🍽️ | 뭐하세영     #STAYC #스테이씨 #ISA #아이사 #Seeun ...
2091.0085480430066,B8UflyqqaIs,석류 초콜릿으로 부자되는 둥키의 요즘유행 초코렛...ㄷㄷ,둥이키친 DUNGYIKITCHEN,2025-12-16 08:17:57+00:00,74936,1508,25,요즘 석류 이렇게 먹는다고! 석류초콜릿으로!
2088.2304487433626,QiQRUc00hWY,"치즈없는 치즈폭탄, 3900원 한식부페, 지드레곤 맥주~ 12월 셋째 주 편의점 신제품 리뷰",맛상무,2025-12-14 03:18:20+00:00,81021,1520,135,CU - 치즈폭탄 콘베이컨 2600원 - 디스이즈 치즈버거 4900원 세븐일레븐 - 치폴레 대파닭구이웜볼4900원 - 치폴레 치킨 김밥 3500원 ...
2024.1963570809667,Pg58vWx85C0,요즘 유행하는 불닭 이거 알아?? #shorts,Jings ASMR 징스,2025-12-21 11:15:41+00:00,59659,1008,89,불닭볶음면 #라면먹방 #asmr먹방 #불닭어묵탕면 #불닭볶음면먹방 #asmreatingsounds #asmrmukbanger #buldak #buldakramen ...
2011.3387826539993,VbqAK0jn0XU,대구 사람들만 안다는 로컬 맛집#대구맛집 #대구핫플 #동인동맛집 #삼덕동맛집 #대구노포 #대구통닭#대구치킨 #동인동밥집 #대구노포맛집 #대구닭불고기,대구핫플여기 대구맛집,2026-01-06 01:45:03+00:00,18476,149,4,
1993.657493838146,r34iVTmY6Qw,편의점 신상리뷰 먹방,편생편사 넷사장,2026-01-09 10:26:55+00:00,7476,111,0,This stream is created with #PRISMLiveStudio.
1981.7466698009382,J69437fWxRE,요즘 유행하는 초코칩쿠키 이거 알아?? #shorts,Jings ASMR 징스,2025-12-23 11:02:57+00:00,53629,831,85,과자먹방 #간식추천 #asmr먹방 #디저트먹방 #초코칩쿠키 #asmreatingsounds #asmrmukbanger #asmrsnacks #asmrdessert ...
1978.990802756723,RfNoxjVD7BM,그래서 이번주 신상이 뭔데?,밈PD,2025-12-18 10:00:51+00:00,80319,0,100,"고독한밈슐랭 #mimpd EP.12 ---------------------------------------- ✔️광고,PPL 문의   ☝  Instagram : mimpd.x_x.official ☝  E-mail ..."
1973.626736175178,EoCGNOBbTGE,🍙 최강록의 소보로 삼각김밥 솔직후기 #쇼츠 #shortst,TodaySolution,2026-01-07 23:58:53+00:00,13256,15,1,가격: 약 1400원 (세븐일레븐 앱/인스타 정보) ￼ 칼로리: 250kcal 영양: 탄수화물 40g / 단백질 6g / 지방 7g ￼ 셰프 최강록 ...
1969.6587705630702,P8701j39nhA,"성수 핫플 말고, 이런 데 갑니다ㅣ정혜드림브이로그 (카페, 레스토랑, 소품샵)",정혜드림,2026-01-09 11:00:55+00:00,6068,146,30,"안녕하세요 여러분~ 정혜가 정해드리는, 정혜드림입니다. 분크 본사가 성수에 있다 보니 오가면서 자연스럽게 알게 된 곳들이 ..."
1963.7590643274852,kJ67IABdr8Y,김치전 가장자리 맛 과자? 김칩스 먹어봄 #김칩스,옝구 yenggu,2026-01-11 15:21:49+00:00,1539,9,0,"제품협찬 김치전 가장자리맛 과자?! 더다믐 김칩스 오리지널은 국내산 쌀가루에 진짜 김치를 갈아 넣어 만든 김치 스낵으로, 전통 부각 ..."
1942.2652677212918,WOBRU_XLirk,GS25에서 보이면 꼭 사야할 간식 2가지 소개해드릴게요!,탄당지,2026-01-06 05:57:42+00:00,16791,171,9,gs25 #편의점신상 #간식추천 #간식리뷰 #젤리 #초콜릿.
1936.2534647865555,UHJxLS1_e7U,1년을 기다렸다... 드디어 재출시된 최강록 레전드 도시락 🔥,알려준데이,2026-01-10 06:49:01+00:00,5308,41,2,"2025년 품절 대란의 주인공, 최강록 셰프의 '간장들기름비빔밥'이 2026년 1월 6일 드디어 재출시되었습니다! 고추장 대신 감칠맛 ..."
1896.907895248034,yokmj99CMK0,세븐일레븐 신상 두바이 쫀득쿠키?!,캐치스피드,2026-01-01 09:45:45+00:00,31517,192,5,세븐일레븐 신상 두바이쫀득쿠키?! 오늘 1/1일 출시된 카다이프 쫀득볼인데 발견하자마자 바로 먹었어요! 가격은 3200원이고 쫀득한 ...
1834.397641707775,JoVmtvGyOts,편의점 신상리뷰 먹방,편생편사 넷사장,2026-01-08 11:56:27+00:00,8983,146,2,This stream is created with #PRISMLiveStudio.
1830.7520330263546,GBC8KI19GMU,"상하이 핫플,맛집 싹 다 갔다 🇨🇳  [상해 3박4일 ] 와이탄•동방명주•디즈니랜드•티엔즈팡•수건케이크•맛집] ",시민김민,2026-01-08 08:43:44+00:00,6089,225,33,3키로는 쪄온 상해 여행 ••   insta: @lovmeeen #상하이 #상해여행 #상하이브이로그 #상하이디즈니랜드 #중국여행 #여행브이로그 ...
1806.3496515596748,jxCBrcmX0Hc,"12월 편의점 신제품, 다 먹어볼게요!!",또호 DDO_HO,2025-12-19 11:02:14+00:00,52954,1194,27,ㅡDDO HO⭐ ♬HO INSTAGRAM | https://www.instagram.com/ddo.ho ㅡ ddo_ho@sandboxnetwork.net ㅡ #편의점 #편의점신상 ...
1801.2801779107085,-rHYBBmNQqU,요즘 유행하는 #두바이쫀득쿠키 #두쫀쿠,심자몬,2026-01-04 09:25:07+00:00,18032,329,26,
1795.6272483742305,Z-vvU2qvXBQ,요즘 핫한 두쫀쿠 CU에도 있음😀 #두쫀쿠 #두바이쫀득쿠키,여행하는 주이 JuyNote,2026-01-03 13:27:03+00:00,24166,109,4,
1775.6807509941755,_Q5qy5K7Cs0,슬기로운 간식생활 #두쫀쿠 #세븐일레븐 #편의점 #편의점두바이 #두바이 #신상 #던킨 #도넛 #도넛먹방 #빵순이 #먹방,Sugary슈가리,2026-01-06 10:42:16+00:00,13817,194,16,
1768.5705059864358,ZbxGM4lVjEo,CU신상 연세우유 딸기크림 맘모스빵?!,캐치스피드,2026-01-07 02:34:44+00:00,13268,110,1,CU에 연세우유 신상으로 딸기크림 맘모스 나왔는데 짱맛있어요! 가격은 3800원이고 빵 사이에 재료가 꽉 차있음 ㅠㅠ 먹으면 돼지 ...
1756.876004597419,WJp7hLpvBRM,박자 맞추기 한번에 성공 가능?!😎 이유식 재료로 박자 맞추기 쉽지 않네요.. . . #박자맞추기 #박자챌린지 #이유식재료,자이티(JYTEE),2025-12-19 07:19:52+00:00,63949,436,21,
1755.77042495994,ae0bipqWzho,꼬미가 알려주는 요즘 핫한 꿀고구마! 너무 핫해서 저도 한번 만들어봤어요🍠 #고구마 #꿀고구마 #간식,꼬미맘마,2025-12-18 09:01:52+00:00,57,5,0,
1751.9824173257623,Xx3NpmB8QiE,요즘유행 | 뚜떰즈업 두바이쫀득쿠키🍫 I (내가) 재미있는거 몇개 낋여옴 I 먹대장 I 육아브이로그,서누네띠네,2025-12-17 09:38:21+00:00,471,29,12,안녕하세요! 서누네띠네입니다   요즘 알고리즘에 두바이쫀득쿠키랑 건과일에 점령당해서.. 저도 한번 해보았습니다..ㅎㅎ 두바이 ...
1751.3428294640642,Fp_xO2gHzW4,요즘 유행인 두바이 쫀득쿠키 만들기 대성공👩🏻‍🍳 | 새해에 나눠주고 마음이 부자 됐어요 💸💸💛 #shorts,필라현짱,2026-01-04 17:52:40+00:00,18625,199,13,
1738.3060297716736,aNQ8G2vG4rg,두쫀쿠 시작 전 카이막이 원조,잇츠에디터,2026-01-08 12:23:11+00:00,9965,20,10,두쫀쿠? 그 전에 이미 디저트 유행은 '카이막'이었음 무려 40시간 숙성해서 만드는 몽글몽글한 흰 뭉텅이 비주얼 꿀 찍어 먹으면…
1728.6657236196718,ByzCak_Op6E,딱 4가지 재료로 만든 다이어트 두바이 크림푸딩,프리니,2026-01-11 02:00:02+00:00,2773,7,1,"당류2g #두바이 #초코크림푸딩 요즘 유행 두바이 크림푸딩, 입안 가득 차는 꾸덕함 때문에 자꾸 생각나죠 근데 밖에서 사 먹으면 ..."
1714.7282059674585,t-pbQZpeaLk,내과의사가 본 두바이 쫀득 쿠키!! #두바이쫀득쿠키,윔 스튜디오,2026-01-01 08:30:36+00:00,24450,385,39,"다이어트는 몸을 줄이는 일이 아니라, 삶의 밸런스를 되찾는 과정입니다. WIM Studio는 비만·대사·노화의 과학을 바탕으로 건강한 ..."
1697.4402348415515,-NPzR5fXB3g,젤라또맛 쿠키초코볼! 먹어봤나요?#편의점신상 #편의점초콜릿,사랑아놀자(Let's Play SARANG),2025-12-18 06:00:00+00:00,60340,696,26,
1692.311678471062,LJo9ReuI9XM,요즘 성수에서 가장 핫한 디저트는 이것? #shorts  #스브스뉴스 #갓나온맛도리,스브스뉴스 SUBUSUNEWS,2025-12-30 09:00:36+00:00,33748,160,6,"구매링크▽ https://bit.ly/4pMiILa ✓ 뉴스에는 위아래가 없다, 스브스뉴스 - 비즈니스 문의 - 브랜디드 콘텐츠 기획/제작 문의: ..."
1682.9301795884696,kZsww4g-prw,세븐일레븐 신상 샤베트젤리?!,캐치스피드,2025-12-17 05:07:31+00:00,62327,738,1,세븐일레븐 신상 샤베트젤리?! 일본에서 건너온 젤리인데 이번에 세븐일레븐에 들어와서 바로 사먹어봤어요! 사각사각한 샤베트 식감 ...
1680.7158181732693,rOOBt5rwidg,리뉴얼~최강록의 소보로 삼각김밥이야~ #편의점신상간편식 #편의점신상삼각김밥 #최강록의소보로삼각김밥,존맛맨,2026-01-07 05:17:41+00:00,12999,44,5,
1673.2288746585286,zFL0RVQFzxs,vlog. 연말 브이로그 부산 당일치기🚄 요즘 핫한 두바이크레페·두바이쫀득쿠키 1일1두바이,노린 Norin,2026-01-04 11:01:44+00:00,193,9,7,"Instagram • nornorinn Contact • sun960204@gmail.com 안녕하세요! 부산 당일치기 브이로그! 그리고, 요즘 핫하다는 두바이크레페 ..."
1653.6893607426755,KleljiJYFHE,"요즘 유행하는 미지근&amp;멀멀 색조로!🌸도우인 반스푼, 데일리 메이크업",쎄씰 Cécile,2026-01-09 11:18:02+00:00,4407,108,33,CONTACT neriia@naver.com BLOG https://blog.naver.com/neriia INSTAGRAM @cecile_makeupbox 안녕하세요! 오늘은 2026년 ...
1652.1440915130067,-TUf2zxTWNw,고기 굽다가 드라마 구경 중? 올유캔잇 바베큐 레스토랑에서 요즘 유행하는거 저도 해봤어요!,수아무아 | Korean Mom English Fix,2026-01-10 07:23:18+00:00,4553,24,1,"고기 굽다 드라마 구경 중?   유행하는 거, 저도 해봤어요ㅎㅎ 이거 같이 해보자고 급하게 부탁드렸는데 미모의 슈퍼바이저님 ..."
1648.4685182767025,i8GCNEndiXk,GS25 신상 말차빵 부부 먹방 😋 #먹방 #mukbang #신상 #편의점 #편의점신상 #빵지순례 #간식 #말차 #디저트 #커플 #연애 #사랑 #결혼 #커플먹방 #먹방브이로그 #빵,먹방탐험대 Mukbbang,2026-01-11 01:27:50+00:00,2670,8,2,
1628.8442066122172,uAyRtnXCKuo,GS25 가기전에 보고가야할 간식 3가지,한설탕,2026-01-05 10:28:16+00:00,14344,232,7,편의점간식 #편의점신상 #신상간식 #신상리뷰 #gs25 GS25 가기전에 보고가야할 간식 3가지 1. 쫀득 초코칩( 가격 : 2000원) ...
1627.7993808049534,8tiORZkp4BE,맛있는 수비드 안심스테이크,먹는사람,2026-01-11 22:27:24+00:00,1292,4,1,라구 파스타랑 안심스테이크 먹고왔습니다 연남동에 있는 비스트로오라인데요 데이트로 오기 좋아보였고 세트 가성비가 괜찮습니다 ...
1618.4497481803496,OCZ2H7yx4oE,과일모양 초콜릿 🍫? GS25 신상! #shorts #신상 #gs25편의점 #gs25신상 #초콜릿 #과일모양초콜릿 #편의점간식 #편의점신상 #신상리뷰 #인생100,인생100,2026-01-03 12:10:27+00:00,23097,0,2,사장님! 이건 좀....;;; ㅎㅎㅎ.
1613.5355453723048,EQ8dQsIAIqU,바다 건너 온 코스트코 신상🇮🇹 한국인 입맛 저격한 코스트코 첫 출시🛒 #코스트코,살림맨,2026-01-05 11:00:31+00:00,15100,184,1,바다 건너 온 코스트코 신상     한국인 입맛 저격한 코스트코 첫 출시   #코스트코 와… 이거 드셔보셨어요? 손바닥만 한 자이언트 ...
1608.3453083655816,qpx1OnHlW-s,"지금껏 만든 초코칩 쿠키 중 베스트! 가장자리는 바삭, 가운데는 초코로 가득, 리플 초코 쿠키! 하늘 아래 같은 초코칩 쿠키는 없어요 Ripple Cookies | 하다앳홈",HADA at HOME하다앳홈,2025-12-29 11:45:15+00:00,18608,683,49,Ripple Chocolate Chip Cookies 쿠키 가장자리에 여러 겹의 주름이 생기는 쿠키를 '리플 초코칩 쿠키'라고 합니다 설탕은 쿠키 ...
1606.9569210087736,pUavbkB_4dQ,"이게 39,000원? 파리바게트 신상 딸기케이크",캐치스피드,2025-12-22 08:47:01+00:00,51796,245,31,파리바게트 신상 딸기케이크?! 베리밤이 새로 나와서 사전예약해서 사왔는데 일단 사이즈 실환가..? 39000원에 샀으면 너어무 억울할 ...
1593.1393919342772,NsCf605Ha14,취향 확실히 갈리는 CU편의점 디저트 TOP3,리뷰하는개미,2026-01-05 14:44:58+00:00,16165,74,1,CU 편의점 디저트 3종 전부 다 추천하진 않았습니다. ✔️ 연세우유 우유생크림떡 ✔️ 연세우유 딸기생크림빵 ✔️ 카다이프 초코 ...
1591.2651987827333,S976lwIC-vI,"ENG) 🇰🇷 VLOG | 서울 성수동 브이로그 | 요즘 핫플이라는 군자를 살짝 곁들인..🤍 | 성수동 맛집, 카페, 빙수🤤☕️🍧 | 윤숲, 송화산시도삭면, 코리야 성수",재니로그JANNYLOG,2025-12-14 11:15:04+00:00,189,5,10,"2025년 09월성수동, 군자에서의 기록 #서울브이로그 #성수동브이로그 #성수카페 00:00 intro 00:19 day 1 03:19 day 2 05:12 day 3 ..."
