score,video_id,title,channel_title,published_at,viewCount,likeCount,commentCount,description
509.33488392524936,nQkON_3qlXw,요즘 카페마다 품절인 두바이쫀득쿠키🥹,봉봉로그,2025-12-17 13:37:02+00:00,14138,124,1,요즘 카페마다 품절인데 두쫀쿠 두켓팅 성공했어요   다시 유행이라길래 궁금해서 참을 수가 없어~ ✨전자렌지 5초 돌려 먹었어요!
506.7403815917011,ij1Y9jxQ5pY,요즘 핫한 전현무 저속노화 김밥⁉️,중꺾레 Endless Recipe,2025-12-16 02:40:21+00:00,19776,61,5,
505.9908301589462,nLmn2qt7P1k,"신상인 듯 신상아닌, 신상같은 과자🍪먹방 브이로그ㅣ고구마 시리즈, ABC초코쿠키,빈츠,후렌치파이 밤ㅣ푸라닭 투움바치킨+로제떡볶이ㅣ스쳐가는 일상 모먼트, 메밀소바, 초코마들렌",제이데이,2025-12-15 09:01:17+00:00,2035,31,16,안녕하세요 독자님들! 출시된지 백만년이 지났지만 여러 고구마 시리즈가 쏟아지는 요즘 시기에 마트 나들이 갔다가 업어온 신상 (내 ...
504.6536973376926,V7BG7A3bqYU,두바이 딸기 핑크 바이트 #두바이초콜릿 #두바이 #두바이디저트 #올더어글리쿠키,간단남,2025-12-14 16:51:36+00:00,17651,112,4,아마 서울에서 유일하게 판매하는 핑크색 두바이 디저트를 먹고 왔습니다! 올해만 몇 번째 방문인지 모르겠..는 올더어글리쿠키에 ...
502.84034693515054,jiVxX7DQAoM,📍요즘 일본에서 핫한 초간단 치즈케이크 ✨🍰 #다이어트레시피 #간단레시피 #치즈케이크 #그릭요거트 #빠다코코낫 #다이어트레시피,소박하지만 따뜻하게,2025-12-23 14:46:39+00:00,13090,58,7,
502.0009217785429,jJ2RH3XTUpM,시장에 두바이붕어빵이랑 두쫀쿠 때문에 난리남..이게 대체 뭐길래,쌔미로드,2026-01-05 12:13:56+00:00,4402,19,3,요즘 핫한 두바이 붕어빵이랑 두쫀쿠✨ 신림에도 생긴 거 아시나요? 아직 동네분들만 좀 알고 계시는데도 벌써 줄이 어마무시 ...
498.1930533012723,-PZNOYBFnZc,편신~적토마토 베이컨 듬뿍 토스트야!~ #편의점신상간편식 #편의점신상샌드위치 #적토마토베이컨듬뿍토스트,존맛맨,2025-12-31 08:05:29+00:00,5694,55,4,
494.8219664295019,D2iJaivf_fI,두바이쫀득쿠키 #호기심 #두바이쫀득쿠키 #초코렛쿠키 #젊은이들,라이프뱅뱅,2026-01-05 01:51:37+00:00,1098,13,9,"요즘 젊은 사람들에게 유행한다는 1인 1팩 파는 두바쫀득쿠키를 1시간 기다려 사온 딸, 어떤 맛일까? 궁금한 마음에 열어서 맛을 ..."
490.34556620547113,SzHQpzdfocQ,요즘 가장 핫한 신당동 짚뿔닭발,하마씨,2025-12-30 01:23:49+00:00,8758,37,1,요즘 신당동에서 가장 핫한 직화 짚불 닭발 새로 오픈한 짚불에 구워주는 닭발로 유명한 신당동 맛집으로 야장에 들어온 듯한 초대형 ...
488.0271443223525,SBL2KOlinV4,편신~서울우유 생딸기 카스테라야~ #편의점신상간편식 #편의점신상빵 #서울우유생딸기카스테라,존맛맨,2026-01-02 23:26:28+00:00,5458,28,7,
485.10037777751245,tNcSUfwY1mg,해외유행 슬라임젤리?! CU편의점신상리뷰 #간식리뷰 #편의점신상 #간식리뷰 #젤리먹방,라우미 LAUMI,2025-12-20 05:27:46+00:00,18309,0,4,
483.9107934516961,58vBqG0LJCo,"요즘 핫한 겨울 별미, 과메기 김밥 저도 말아봤습니다!!!😋",해운대 공구왕 송사장,2025-12-17 08:05:14+00:00,14153,101,8,"요즘 핫한 겨울 별미, 과메기 김밥 저도 직접 말아 먹어봤습니다     아시죠? 원물이 좋아야 음식이 맛있는 거   대나무 발 위에 한 ..."
479.742426280077,9nH3Jb-KXrA,요즘 핫한🔥 두바이쫀득쿠키🤩#미니유니#유니#두바이쫀득쿠키#쫀득쿠키#두바이초콜릿#두바이#신세계#대구신세계#신세계백화점#주토피아#주토피아2#zoo#zoo챌린지,미니유니,2025-12-16 08:56:27+00:00,10458,122,6,
477.85365750609674,mpDLK4aS7KU,편의점 신상털이,밈PD,2025-12-18 10:01:31+00:00,19213,0,10,고독한밈슐랭 #편의점 #CU #gs25 #shorts.
476.03875516079006,u9IfWqxRkr4,요즘 MZ픽! &#39;두바이&#39; 디저트 는 왜 다시 뜰까?｜ TJB,TJB NEWS,2025-12-26 04:10:46+00:00,11071,39,7,여러분의 소중한 제보를 받습니다. 홈페이지제보 - http://www.tjb.co.kr/sub0305/news/reports_form 카톡ID : TJBTBOB 이메일 ...
468.64533895112316,mnHOMthz60I,범어동 숨겨진 보물 국내산 생막창집🔥🏠#두리막창 #대구맛집 #대구핫플 #수성구맛집 #대구막창맛집 #범어동막창 #범어동맛집 #범어동핫플 #대구막창,쭈링🩷 대구맛집 대구핫플 대구여행 대구카페,2026-01-06 01:45:08+00:00,2656,26,1,
466.19745490226234,2Vu3i6b6HKA,두바이쫀득쿠기 만들 수 있을까?,뿌잉뿌앵,2025-12-25 16:10:45+00:00,12553,17,4,두바이쫀득쿠키 #두바이초콜릿 #커플 #커플브이로그 #커플유튜브 #커플일상 #연인 #데이트 #커플쇼츠 #유튜브쇼츠 #shorts #커플 ...
463.7090393318999,89rXydlvivg,GS25 미쯔 블랙 요거트 출시 #신상 #신상리뷰 #편의점신상 #GS25,미니미,2025-12-25 02:30:11+00:00,10186,62,1,"이거 꽤 괜찮은데요,,,? GS25 신상 미쯔 블랙 요거트가 출시 됐어요 가격은 2300원 상큼하면서 꾸덕한 요거트에 바삭하고 달달한 미쯔 ..."
461.08628611397734,j-Vra7UNLtU,편의점 신상 빅초코파이와 삼육두유크림도넛! 과연 그 맛은?! #shorts #shortvideo  #mukbang #먹방 #편의점신상 #편의점신상리뷰 #빅초코파이,살찐말괄량이삐삐 fatppippi,2026-01-09 08:36:07+00:00,1354,10,1,
458.0136121748761,cT-O_RU5s5Y,CU 12월 24일 부터 나온 신상 모음집~ #편의점신상간편식 #편의점신상도시락 #CU신상모음집,존맛맨,2025-12-27 05:45:04+00:00,4962,66,1,
456.35558345087406,AlD4DD6XGqM,"160kg의 하루,,요거트 치즈케이크,,요즘 유행템 못참쥐~완전 성공적!!",으뇽이,2026-01-06 13:00:23+00:00,3771,9,0,
455.21476501820837,WJj0-XxzTCU,일본에서 유행이라는 요거트 치즈케이크 만들기 🍰The Yogurt Cheesecake everyone is talking about #breakfast #vlog #shorts,김모닝,2025-12-28 13:31:42+00:00,7882,50,1,
453.5322468353323,1pKry5j3XcQ,세븐일레븐 적토마토버거 내돈내산  #먹방 #food #편의점신상 #세븐일레븐 #먹방,한입만,2026-01-09 09:00:03+00:00,1665,7,0,
447.8382876688597,n0FSGHfsqic,딸기크림 폭탄 도넛💕…#간식 #신상 #딸기 #도넛 #snacks #먹방 #리뷰 #추천 #mukbang #먹부림 #오늘뭐먹지 #eating #디저트 #서울우유 #strawberry,먹보,2026-01-07 07:40:49+00:00,731,6,7,GS25 서울우유 딸기크림도넛 한 입 베어무는 순간 딸기크림 폭발 크림 쏟아지는 순간 심장 멎음… 가격 : 2700원 #간식 ...
445.11241605278144,HIAAEYWntMQ,요즘 일본에서 유행하는 치즈케이크를!!     #치즈케이크#チーズケーキ#shorts,구르미당,2025-12-31 11:45:02+00:00,5924,37,4,여러분 올해도 곧 끝나가네요.. 시간이 너무 빠르게 흐르는 것 같아요!! 다들 올 한 해도 고생 많으셨습니다   새해에는 더 건강하고 ...
441.64556380944265,Yr7nYidjajs,두바이에 환장한 CU,비만88,2025-12-20 12:01:00+00:00,14113,45,2,CU #편의점 #신상 #두바이신상 #먹방 #asmr #디저트 #shorts.
438.17972328278006,GoYihUfj5f0,편신~누텔라 스모어 토스트야~ #편의점신상간편식 #편의점신상샌드위치 #누텔라스모어토스트,존맛맨,2025-12-31 07:49:52+00:00,4921,40,6,
437.9859331184929,8c3w6R10mJI,Cu12월31일 부터 나온 신상 모음집~ #편의점신상간편식 #편의점신상리뷰#Cu신상모음집,존맛맨,2026-01-04 00:21:11+00:00,4129,26,1,
436.6875639407905,sHRA5AqqjhU,#AppleCakeRoll#ViralDessert#CakeRoll#AppleDessert#DessertTrend#TrendingRecipe#EasyDessert#HomemadeCa,just cooking ,2025-12-21 09:43:02+00:00,521,9,2,AppleCakeRoll #ViralDessert #CakeRoll #AppleDessert #DessertTrend #TrendingRecipe #EasyDessert #HomemadeCake ...
430.63422912607575,wwdthGEANck,편신~당면이 들어있는 설렁탕이야~ #편의점신상간편식 #편의점신상도시락 #당면이들어있는설렁탕,존맛맨,2025-12-20 02:06:43+00:00,9722,80,6,
425.23729015532047,MSLLWchwpl8,편신~당근 명란마요 삼각김밥이야~ #편의점신상간편식 #편의점신상삼각김밥 #당근명란마요삼각김밥,존맛맨,2025-12-31 05:57:13+00:00,2850,33,7,
423.93265285186914,Bq8p6JenmRE,두바이딸기소라빵?!,대식잇,2025-12-15 07:34:25+00:00,7272,95,2,두친자들을 위한 두바이소라빵?! 잠실 킴스델리마켓 아니 내가 두친자다? 그럼 여긴 무조건 저장하세요. 두바이 맛집으로 유명한 킴스 ...
420.80615171096173,GRC75qHaRBU,😱 Maggi Egg Pudding? Yes! Super Soft Dessert #Shorts,Puviya Kitchen,2025-12-22 13:49:40+00:00,10010,53,11,"Viral Maggi Egg Pudding you won't believe! This super soft & creamy egg pudding is made using Maggi noodles + eggs, ..."
419.8988533437375,Wjk4yPPZq4U,요즘 핫한 연어 깍두기 + 육회 깍두기 사시미 먹방 ASMR MUKBANG Spicy Salmon &amp; Raw Beef,장가한우,2026-01-08 11:00:58+00:00,395,7,0,장가한우 #연어깍두기 #육회깍두기.
419.5924520603251,nyYDP8fS0qk,오븐 없이 만드는 일본 SNS 유행 빠다코코낫 치즈케이크🧀｜그릭요거트 초간단 디저트,슬비하이,2025-12-31 10:30:43+00:00,6691,21,4,오븐 없이 만드는 치즈케이크 레시피예요 요즘 일본 SNS에서 유행 중인 빠다코코낫 + 그릭요거트 조합으로 만들어봤어요 유청을 ...
419.1875572921069,zPinwdLkPzI,상큼한 딸기가 콕?박힌 서울우유 딸기크림도넛!#신상 #편의점 #디저트 #리뷰 #dounuts,빵터진 엄마,2025-12-29 09:55:01+00:00,4661,49,1,구독과좋아요는 영상을 빵터지게 만듭니다 #편의점신상 #내돈내산 #desert #strawberry.
418.2903394767797,syAKX0GqoO0,동성로 클골에 진짜 큰거 왔음;; #수풀림 #대구맛집 #대구핫플 #동성로맛집 #동성로핫플 #반월당핫플#대구데이트 #대구연말모임 #대구회식 #대구신상,쭈링🩷 대구맛집 대구핫플 대구여행 대구카페,2025-12-30 10:45:11+00:00,6354,36,1,
411.5810828497481,BoLiwBih4qA,편신~당근라떼 김밥이야~ #편의점신상간편식 #편의점신상김밥 #당근라떼김밥,존맛맨,2025-12-31 01:44:17+00:00,5280,36,3,
410.5229893978833,kYlqbmsuPME,*가격실수!!!!$10입니다 한개에 ! (price $10 ea)요즘 난리난 두바이쫀득쿠키 #엘에이맛집,줄리아랄랄라,2025-12-31 23:26:50+00:00,4654,31,6,"HARUCAKE 3450 W 6th St #107, Los Angeles, CA 90010 디저트는 잘 안 먹는데 이건 궁금해서 다녀와봤어요. 재밌는 경험 ..."
403.2853659972229,PAD8aq5aQIU,요즘 유행하는 편의점 라면 레시피 (진짜 맛있음),시식코너,2025-12-29 12:02:39+00:00,4605,43,3,
402.09307290727304,ARSg7m7PJN0,"🇨🇦요즘 핫한 밴쿠버 맛집들을 다녀왔어요, 정말 착한 식당부터 왜 줄서는지 모르겠는 식당까지! 에이미브이로그",에이미븨로그_Amie,2025-12-20 03:54:48+00:00,5890,71,2,"제가 다녀온 레스토랑 정보는 아래 참고하세요 • 한끼 20718 96 Ave, Langley, BC • 라포레 어스틴점 1135 ..."
391.14428824554545,T2tet5rDNEI,🔥요즘 제일 핫한 레시피｜임성근 돼지고기 짜글이 (Korean Spicy Pork Stew)｜흑백요리사2,찐밥상,2026-01-02 06:20:19+00:00,3504,24,7,임성근 돼지고기 짜글이 요즘 가장 화제인 프로그램 흑백요리사2 그 중심에 있는 임성근 셰프의 돼지고기 짜글이 레시피를 1g 단위 ...
387.41420547688637,iozPFGC9FCk,요즘 유행하는 쇼츠 우리도 해봄. 인플 &amp; 담클 연말파티 #인플 #담클 #함평로컬푸드직매장 #행복이랑우숨도예 #송년의밤,해름,2025-12-23 14:17:46+00:00,11382,18,3,
375.93390778176104,grxjE5CtBqY,GS25 신상 간식 부부 먹방🐷 #먹방 #mukbang #맛집 #신상 #과자 #간식 #편의점 #커플 #연애 #사랑 #결혼 #신혼부부 #커플브이로그 #먹방브이로그 #love #디저트,먹방탐험대 Mukbbang,2025-12-30 09:29:57+00:00,4727,36,0,
375.11262407319765,2-YG1iEBUnc,GS25편의점 신상 바나나 오렌지 소르베?! 과연 맛은 어떨까요?! #편의점신상 #gs25편의점 #신상아이스크림 #아이스크림먹방 #간식리뷰,라우미 LAUMI,2025-12-18 13:51:43+00:00,14649,0,12,
374.9690404628091,t0BhpAJIxoE,편신~삼립 소보루 꿀호떡이야~ #편의점신상간편식 #편의점신상리뷰 #삼립소보루꿀호떡,존맛맨,2025-12-25 04:50:08+00:00,6054,44,8,
373.47647948055857,iME8LYvAO5k,"편의점 신상 사냥하다 크림빵 파티하기🧁ㅣ카페인중독 꿀고구마와플,햅쌀와플,GS편의점 크림깨찰빵, 피스타치오초코칩,피타브레드, 붕어빵 먹방브이로그",제이데이,2025-12-22 09:01:13+00:00,2807,37,4,안녕하세요 독자님들! 오늘은 편의점 투어와 크림빵 왕창 먹었던 일상 브이로그입니다!ㅎㅎ 혹시 다들 고구마 신상들은 드셔보셨나요.
371.85587082098294,pMAhna6IlH0,요즘 일본에서 핫한 츠키 강남 박명수 추천 돈키호테 품절대란 밥도둑,싹다모아 HOT꿀템,2025-12-18 09:01:20+00:00,10548,60,1,돈키호테 좋아하는 친구에게 공유해주세요   ​ ​ #강남추천 #강남라유 #라유 #츠키라유 #박명수라유 #박명수돈키호테 #돈키호테 ...
371.0538322874654,W8pT6kMUkaU,호주워홀 | 요즘 유행하는 두쫀쿠 만들기 | 멜버른브이로그 | 두바이쫀득쿠키,코비네이션 Kobination,2025-12-15 08:58:48+00:00,386,3,4,멜버른에서 만든 두바이 쫀득 쿠키 (약 30개) 총 비용 약 $90 준비물 카다이프 500g 피스타치오 스프레드 200g × 2 마차 ...
368.41471994208376,7xP-pexKGO8,요즘 유행한다는 두쫀쿠를 먹어봤습니다👍🏻두쫀쿠는..사먹으세요#두바이쫀득쿠키 #두쫀쿠#food#asmr#추천추천추천추천추천추천추천추천추천추천 #유행#트렌드,꾸미앙팡,2026-01-06 05:01:36+00:00,3372,4,0,
368.16486809443876,qRsyFq9zepc,두바이 쫀득쿠키 집에서 만들어봤더니… 이게 되네? 요즘 핫한 두쫀쿠,유라야놀자(Let's play YURA),2026-01-03 08:01:05+00:00,4275,0,16,요즘 SNS에서 핫한 두바이 쫀득 쿠키(두쫀쿠) ❤️ 카다이프와 피스타치오 스프레드 없이 집에서 쉽게 만들어 먹어봤어요!
359.8736274348443,UEWKp8Z5iD4,요즘 유행하는 일본 치즈케이크 (나름 다이어트) 레시피,츄빈 CHUVIN,2026-01-04 12:52:05+00:00,3031,10,8,너무 맛있고 쉬우니까 꼭 해보셔요   #치즈케이크 #디저트레시피 #빵먹방 #디저트.
358.3556825278469,A4S6Zpxt2r0,"프랑스 파리 요즘 떠오르는 핫플, 마레지구 자유여행 브이로그🇨🇵 (OFR book store, Merci, 맛집)",밍띡이 Mingsik,2025-12-15 09:00:14+00:00,56,1,0,안녕하세요 밍띡입니다   오늘은 파리 현지 감성 가득한 마레지구를 다녀왔습니다. 1. 불로뉴 숲(Bois de Boulogne) : 파리 도심 속 ...
358.02231003471275,8LuTIEATOCE,요즘 유행하는 두바이쫀득쿠키 만들기 🍪 | 집콕 일상로그,Areum log,2025-12-22 10:40:15+00:00,1037,13,4,오늘은 요즘 유행하는 두바이쫀득쿠키와 쫀득쿠키 만드는 영상을 가져왔습니다 크리스마스 겸 연말선물하기에도 좋을 것 같아서 집 ...
354.8649375314926,Rm5bgpWwsLA,❌엄마 몰래 먹기❌진짜 먹고 싶었는데 편의점에도 나왔다‼️ #꾸덕젤리 #슬라임젤리 #편의점신상 #젤리신상 #먹림이,먹림이,2025-12-13 03:48:05+00:00,13891,50,3,
353.8292325759751,8TXFH5_K4Vo,붉은말의해 케이크 사왔는데요‼️사실은,코냐코냐,2026-01-01 14:43:28+00:00,5071,14,2,"요즘 유행하는 빠다코코낫, 요거트로 만든건데 어쩌다보니 이틀 숙성   망했어요‼️ 폭삭 망했어요‼️ 옆에 있는 칼을 들어 수습 ..."
345.8064273327596,siY6svzWHKc,배달 끊고 냉동실 채웠더니 생긴 일,TOORUMI,2025-12-18 09:30:36+00:00,11318,38,2,"퇴근하고 집에 오면 밥할 힘도 없어서 배달만 시켜 먹다 보니 식비는 식비대로 나가고, 건강도 점점 안 좋아지더라구요. 그래서 주말에 ..."
344.70540425773675,VAcFINvVxmM,요아정 두바이쫀득쿠키 후기 #shorts #먹방 #아이스크림 #food #dessert #유튜버,김골디,2026-01-08 13:04:59+00:00,1312,7,1,"shorts 화제의 '두바이화제의 '두바이쫀득쿠키' 요아정에서도 판다고?! ✨ 요즘 SNS, 블로그 할 것 없이 계속 보이던 바로 그 이름 ..."
344.15006247013457,0KxHWlRdEPA,두바이쫀득쿠키 편의점vs제과점,__mumuk__오늘뭐먹지?,2025-12-16 08:05:55+00:00,12482,38,2,팔레트디저트 두바이쫀득쿠키 4700 두바이초코마카롱 4500 새별과자점 두바이쫀득쿠키 5000 CU편의점 카다이프 쫀득 찹쌀떡 ...
340.945783158892,f_7H1aqikII,"#명동, #핫플 #포장마차, 먹자골목, 패션골목, Myeongdong, 음식점, #크리스마스이브, 비오는날, 심야, #김대건신부상, #마리아상, 명동역,  ⁨@WRD-TV⁩",subeom kim wooreedulTV,2025-12-25 01:01:54+00:00,59,1,0,"명동, #핫플 #포장마차, 먹자골목, 패션골목, Myeongdong, food stalls, food alley, fashion alley, 음식점, #크리스마스이브, 비오는날, ..."
340.27533654962554,Z_tTDQ7TBhI,두바이 쫀득쿠키 사먹다. 쫀득 껍질 돌모래떡. 미타라시 당고 맛있네!🍡,강아지꽃나무,2026-01-05 10:41:28+00:00,1861,12,4,안녕하세요 강아지꽃나무 시청자 여러분~! 오늘은 요즘 유행하는 두바이쫀득쿠키를 사먹어봤어요. 카다이프와 피스타치오 잼이 섞인 ...
339.755069850543,wsErmHVLDHg,#맛집#가볼만한곳#발리#핫플#메뉴추천#찐 🍽️,뷰앨_Viewal,2026-01-01 09:54:40+00:00,661,10,0,
337.44132792190464,gh-qbRdeIZc,요즘 핫한 두바이 오트밀 #두바이카다이프 #오버나이트오트밀 #오트밀레시피#다이어트간식 #간편아침 #건강디저트 #두바이쫀득쿠키 #두바이,오빛 (O’bit),2026-01-05 11:52:47+00:00,2220,15,0,요즘 핫한 두바이 오트밀 #두바이카다이프 #오버나이트오트밀 #오트밀레시피#다이어트간식 #간편아침 #건강디저트 #두바이쫀득 ...
337.0160697157186,hU0YWT9Pr2I,두쫀쿠 먹방 #로블록스 #두바이#두쫀쿠 #편의점 #먹방 #신상템 #치킨텐더,루키,2026-01-07 07:46:14+00:00,1933,9,0,
336.01175109689507,u96CMuavM9U,Gs25 12월 24일 부터 나온 신상 모음집~ #편의점신상간편식  #편의점신상도시락 #gs25신상모음집,존맛맨,2025-12-27 06:00:54+00:00,2938,31,2,
331.8802096383419,HbWqaApbLDM,4대편의점~ 12월31일 부터 나온 신상 모음집~,존맛맨,2026-01-04 07:00:19+00:00,474,6,1,편의점신상간편식 #편의점신상도시락 #편의점신상라면.
329.1109880586703,ckxPrf2h_fA,빵 없이 만드는 역대급 케이크? 요즘유행 요거트케이크!!,깔롱살롱제주,2026-01-07 08:23:07+00:00,2397,3,0,오븐도 불도 필요 없는데 비주얼은 카페급인 요거트 케이크 만들기 층층이 쌓인 과자가 촉촉한 시트가 되는 마법을 확인해 보세요!
327.81425643779926,U7ZB43_ilaM,부산 남천동 횟집에서 와인을? 예약 필수 핫플 &#39;왕초장&#39; 알바 체험 (남천해변시장 맛집 추천) | 부사수 | 왕초장 | 남천해변시장,부사수 - 부산 사장님들의 수다,2025-12-23 19:45:02+00:00,4994,38,5,부산 남천동 왕초장 사장님의 휴먼 다큐 스토리 부산 남천동 남천해변시장에 위치한 이색 맛집 '왕초장'에서의 일일 알바 체험기!
327.4325268025897,oQTeG_8kHHc,요즘 유행하는 쫀득 고구마 만들기🍠 #군고구마 #고구마 #레시피 #요리 #요리레시피 #먹방asmr #koreanfood #food,여기가짱,2025-12-18 11:37:23+00:00,9705,44,0,
324.0742504996052,-rk8G8ebsEY,요즘 유행하는 회춘약 #shorts,대한심장TV,2025-12-18 15:00:01+00:00,5175,50,1,nmn #크릴새우오일 #비타민c.
320.39710296478574,O_GP0WRs3j8,신상 디저트 먹방,냐미냐미,2025-12-16 02:04:58+00:00,1304,19,0,이마트24 #신상 #편의점디저트 #이마트24디저트 #디저트파라다이스.
318.723581171728,jDmIyHcoEaA,요즘 유행하는 사회실험 애덤목소리 vs 내 목소리 #치폴레,미국사는정아씨,2025-12-28 02:33:59+00:00,5333,26,2,애덤 목소리 vs 내 목소리 .. 내 치폴레 최애 조합 공개 ✔️ 치킨 보울 ✔️ 라이스는 브라운 라이스 ❌ 콩은 패스 (콩 싫어 ...
317.1230404388242,mHqV2o7A9F0,요즘 핫한 두바이 쫀득쿠키 직접 만들어봄 🤍,Harubbang 하루빵,2025-12-17 14:18:12+00:00,525,6,2,"요즘 계속 보이길래 안 만들 수가 없었던 두바이 쫀득쿠키 겉은 바삭, 안은 쫀득 피스타치오는 아낌없이 넣고 초콜릿은 진하게."
314.648099473839,FAkKkcJiPaU,요즘 핫한 신상 컵라면 먹방 mukbang korean cup ramen asmr,영미(味),2025-12-15 08:54:30+00:00,1487,17,4,shorts #먹방 #asmr #mukbang #컵라면먹방 #컵라면리뷰 #신상라면 #편의점신상 #라면추천.
310.03527022600656,DvRKaf9Dx90,[창원맛집] [용호동맛집] 찜닭 맛집 깡돌찜닭 솔직 후기! 명인 손맛 미쳤어요🔥#맛집 #food #창원맛집 #창원용호동맛집 #창원가볼만한곳 #창원찜닭 #깡돌찜닭 #창원핫플,mukbang,2026-01-07 13:33:32+00:00,1089,1,8,[창원맛집] [용호동맛집] 찜닭 맛집 깡돌찜닭 솔직 후기! 명인 손맛 미쳤어요  #맛집 #food #창원맛집 #창원용호동맛집 #창원가볼만한 ...
308.96866726615343,wHJFVM3Shtg,신혼부부 집밥 | 요즘 유행 참치 + 김치계란 김밥,태나홈 Taena home,2026-01-02 12:01:49+00:00,2342,13,6,태나홈   신혼부부 집밥 계란에 씻은 김치를 넣어 만든 김치계란김밥 + 요즘 유행하는 매콤참치 제가 김치를 좋아한다고 예전에 ...
306.41127968570703,1c77f_IO6aI,요즘 핫한 대전 성심당 말차시루 🍵✨,수영여행 suyoung trip,2025-12-29 00:58:40+00:00,4048,24,3,말차 좋아해서 궁금했던 성심당 말차시루 달기만 한 케이크일까 걱정했는데 생각보다 말차 특유의 쌉싸름함이 느껴져서 끝이 느끼 ...
304.5194256613099,s7c6nJ9-nws,신상라면 농심 신라면 골드 닭육수라는데 국물은 갠찮은데 걍 그럼 별로 #신상 #신상라면 #noodles #신라면골드 #라면 #라면먹방,87홍삼,2026-01-05 02:21:13+00:00,1435,11,2,
297.7657238423218,zo4JZwJVJww,요즘 유행하는 두쫀쿠 대략 2만원으로 10개넘게 만들 수 있다?! / 토다냥 / #두쫀쿠 #유행 #13년생 #추천추천추천 #알고리즘 #떡상기원 #떡락멈춰 #관리자님추천뜨게해주세요,토다냥,2025-12-28 07:29:27+00:00,922,10,2,
296.79120552836326,WKj808EFp1U,요즘 유행하는 사회실험 내 목소리 vs 애덤 목소리 #치폴레,미국사는정아씨,2025-12-28 02:35:09+00:00,2050,22,0,애덤 목소리 vs 내 목소리 .. 내 치폴레 최애 조합 공개 ✔️ 치킨 보울 ✔️ 라이스는 브라운 라이스 ❌ 콩은 패스 (콩 싫어 ...
293.0815371173989,4H-Uq32GgB8,편신~타코 스타일 버거야~ #편의점신상간편식 #편의점신상버거 #타코스타일버거,존맛맨,2025-12-26 07:33:06+00:00,4084,29,1,
292.78151285067815,HOJJc8JTtHE,소문대로 맛있을까?🍞 손종원 샌드위치 #흑백요리사콜라보 #손종원 #편의점신상,요즘난리템,2026-01-05 08:37:14+00:00,2113,8,3,'화제의 흑백요리사2'에 출연중인 손종원 셰프의 '아보카도 듬뿍' 샌드위치는 맛있을까? '흑백요리사2' 콜라보 메뉴의 포문을 열어주는 ...
292.77038352532264,kY1wQPQLrOs,CU 신상 치즈 바이트 출시 #신상 #신상리뷰 #CU #편의점신상,미니미,2025-12-18 02:30:42+00:00,5388,42,2,피자 꼬다리 좋아하는 친구가 있다면 태그해주세요   CU 신상 치즈 할라피뇨바이트와 치즈파프리카바이트가 출시 됐어요 담백한 ...
288.943946052799,86gXbnctY5w,두쫀쿠 득템기 (어쩌다가 구매) 찐후기 있음,암티풀라이프,2025-12-27 21:11:58+00:00,4126,24,2,요즘 두바이쫀득쿠키가 핫 하다는 말에 결국 저도 줄 섰죠 건강에 좋을지는 모르겠고 맛은… 솔직히 궁금했어요 이래서 다들 먹나 보다 ...
287.38988250611385,nYUBOMC41wI,세븐일레븐 신상 과자 부부 먹방😋 #먹방 #mukbang #과자 #신상 #편의점 #간식 #디저트 #세븐일레븐 #커플 #연애 #사랑 #결혼 #신혼부부 #먹방브이로그 #커플브이로그,먹방탐험대 Mukbbang,2026-01-05 09:31:24+00:00,2178,10,0,
286.40616976327686,_G1VpLoHUSQ,요즘 유행하는 #아이스귤 만들기 ☺️,양하우스,2025-12-24 11:26:34+00:00,1976,22,0,
282.5252986009204,_wYrxNkmG60,두쫀쿠🍪 #두쫀쿠 #두바이쫀득쿠키 #쿠키 #핫플 #핫템 #dessert #디저트 #서울맛집 #강남맛집,퇴또녀,2026-01-04 10:38:36+00:00,2455,11,0,
